data,label,label_self_training
tokopedia sekarang tidak beres pengiriman ekspress kok jadinya ekonomi jaminan barang tiba sesuai yang tertera hanya omong kosong saja telat sudah bermingguminggu tidak cepat direspon admin tokopedia carenya budek dan lambat diajukan komplain dan permintaan dikembalikan very slow parah sekali mikir sekian kali lagi untuk transaksi di tokopedia,,negatif
belanja lebih mudah,,positif
jelek dikembalikan saldo hrus tunggu x jam penarikan saldo hrus tunggu jam,,negatif
narik saldo ke rekening akun sendiri d tahanngeselin padahal buat belanja lagi membuat kapok naro saldo nominal besar di tokopedia gaes kalau mau narik uang jangan langsung sekaligus lama sedikit sedikit aja uang kita sebagai pembeli di tahan,,negatif
beberapa fitur perlu perbaikan untuk pengalaman belanja lebih lancar,netral,netral
kecewa banget sama pelayanan pihak tokopedia ini pelayanan lambat banget sumpah penarikan dana dikembalikan ke rekening lama acc nya heran banget pedahal klo tiktok mah hitungan detik ini tokopedia berhari hari kok bisa gitu pedahal penarikan saldo kan kadang di perlukan loh jadi tolong direvisi lagi pelayanan nya gercep dong jangan lambat sumpah kecewa banget,,negatif
hati jika anda sebagai buyer dan berbelanja di tokopedia saat buyer mengalami penipuan dari seller csf tokopediacare tidak menanggapi kasus dengan detail dan progresif berulang kali menghubungi customer service tidak ada tanggapan hanya dibuatkan tiket komplain dan tidak ada tindak lanjut terkait saldo kompensasi dan dana dikembalikan pun hanya omong kosong selamatkan uang anda dari kejahatan sistem tokopedia,,negatif
pembayaran semakin mudah dan praktis ekonomis,,positif
pelayanan buruk customer service hanya bot alamat tiba berubah sampai di retur pesanan saya,,negatif
woy pedia saya punya pantun buat lo dengerin y beli pulsa dapat cashback cashbacknya membuat susah katanya ecommerce terhebat promo palsu membuat resah maka tuh pantun hinaan hahahaha,,negatif
oi yang benar lah stlah kali update mau ganti mode pembayaran aja lambat baget tidak bisa tunggu nya sampai th apa lagi mau cekout susah benar,,negatif
cukup puas belanja di tokopedia hanya ongkir terlalu mahal kalau bisa ongkir di kurangi itu aja,,negatif
aplikasi tidak bisa di buka,,negatif
sekarang kurang asik buat berselancar di tokopedia setiap klik etalase terus balik lagi malah di ulang dari awal lagi balik scroll keatas lagi menganggu banget tidak nyaman,,negatif
admin lambat sampai sekarang belum solve pesanan saya,,negatif
saya pesan tab di toko seller tanggal oktober di estimasi sampai tanggal oktober di kirim nya malah tanggal oktober dan dari tanggal sampai tanggal oktober tidak ada update apapun di lacak masih di tangan kurir sudah chat ke seller tapi respon seller seperti tidak peduli kaya lepas tangan gamau tanggung jawab udah ngajuin komplain tapi di tolak alasan barang sudah di kirim dan admin tokopedia pun slow respon malah gada solusi sama sekali jelek banget sumpah,,negatif
ketika pengiriman barang tidak sampai dan return ke penjual dikembalikan debit online hari lamanya ini buruk sekali dan ini ke x nya tokopedia harus perbaiki ini karena pembeli akan menunggu lama untuk bisa membeli lagi,,negatif
fitur notifikasi menginformasikan status pengiriman,netral,netral
oke sih simpel dan sangat membantu dalam belanja,,positif
keren,,positif
masa cman pro kepada penjual aja,,negatif
good lebih mutakir dan enteng dan nyaman d gunakan,,positif
beberapa kali order selalu lewat dari estimasi dari sekian yang terlewat hanya yang diberikan konpensasi itu pun karna saya terus laporan kalau di shopee otomatis dapat vouvher konpensasi disini hadeuuh kecewa jauh dari harapan pelayanannya,,negatif
paling bagus untuk berbelanja di toko pedia ini,,positif
sudah tidak layak ada di market indo wd uang masa seminggu ber putar dulu ke bank dunia kali ya,,negatif
ribet banget segala harus diverifikasi barang gojek ribet lambat lama,,negatif
tempat beli barang,netral,netral
feed yang saya following tidak bisa discroll jadi tidak bisa lihat update stok toko favorit,,negatif
bisa liat detail toko dulu sebelum beli barang,netral,netral
enak gampang banyak diskon cocok lah ama saya si sultan dubai,,negatif
ecommerce paling jelek ribet ngaco sedunia user dan seller paling dirugikan ada masalah tidak bisa chat dengan customer service hanya dilayani bot yang tidak ada manfaat uninstall langkah terbaik atas aplikasi ini,,negatif
tambah kan fiturnya terus tambah kan diskonnya dong,netral,netral
mulai lambat sekarang malah tambah banyak toko tidak amanah,,negatif
proses dikembalikan sulit dan berbelit lebih bagus shopee,,positif
mantap sekali,,positif
sekarang kenapa agak lama yh,,negatif
apaan coba masa mengirim paket dari jatim ke jateng hari belum datang kocak aplikasi mending disebelah hari sudah datang,,negatif
good aplikasi gratis ongkir semua yang kita mau ada di sini,,negatif
beli di tokopedia cara pembayaran sangat mudah lewat aplikasi apapun langsung deal,,positif
pelayanan dan fasilitas cuma gitugitu aja tapi biaya layanan naik terus buat nutupin harga saham yang tidak ketolongan ye transaksi batal pun juga biaya layanan tidak dikembalikan bubar aja dah kalian tokopedia,,negatif
oke,,positif
mantap,,positif
suka banget beli online,,negatif
aplikasi tipu,,negatif
bagus,,positif
sistem retur barang ga jelas dana pengembalian belum cair cair udah hari tokopedia ga jelas jangan pada mau belanja disini kalau ada bintang minus saya kasih,,negatif
oke,,positif
kenapa saya tidak bisa daftar program affiliate,,negatif
jelek tidak bisa pesan pakai bebas ongkir,,negatif
lebih nyaman ini ketimbang si oren,,negatif
hapus opsi jasa pengiriman ekspedisi ninja xpres,netral,netral
klaim asuransi kerusakan dari solusiutama pembohong sudah bayar asuransi namun klaim di tolak aneh rugi bayar asuransi,,negatif
sekarang ada error di bagian feed folowwingtidak bisa scroll mohon segera diperbaiki,,negatif
sangat membantu,,positif
pesanan di batalkan dan uang dikembalikan saya belum kembali sampai lebih dari hari lewat mandiri,,negatif
proses penarikan dana sangat susah sama sekali tidak ada respon customer service sangat menyesal menggunakan toko pedia untuk semua nya lebih baik menggunakan aplikasi orange,,positif
terbaik,,positif
aplikasi nya lebih bagus dari shopee tapi biaya pengiriman nya mahal,,negatif
semoga kedepannya sukses terus,,positif
kalau harga mahal bisa beli ketika harga murah langsung aja error,,negatif
mudah murah,,positif
oke,,positif
begitu ada diskon langsung error,,negatif
tokopedia mantap,,positif
ribet dan bertele tele dalam komplain,,negatif
sekali minggu update,,negatif
oke banget,,positif
kok susah amat masuk aplikasinya,,negatif
pengembalian saldo belum di dikembalikan padahal peraturannya kalau dikembalikan ke gopay hanya x sehari tapi ini sudah lebih dari sehari tolong saya hanya ingin uang saya kembali,,negatif
error mulu si mau mesen tidak bisa saya,,negatif
dapat kupon terus setiap hari belanja online,,negatif
jangan pakai aplikasi ini sekarang jelek banget pelayanannya buruk lama nunggunya customer servicenya tidak berguna tidak bisa ngapa ngapain pesanan produk aja tidak bisa ngurus hanya dibuat mutermuter mending pakai aplikasi shopee aja atau lazada apa yang lainnya yang fokus buat jualan yang tidak kaya tokopedia jelek banget apalagi sejak kerjasama dengan tiktok jadi lebih parah aplikasinya kaya orang tlol yang mau di buat mutermuteruninstall tokopedia pindah ke yang lain,,negatif
good experience,,negatif
mantap,,positif
tidak perlu ribet sangat cepat,,positif
belum pernah beli,,netral
murah semoga semakin murah lagi,,positif
ongkir bos diturunkan,,negatif
dah malas belanja di tokopedia tiap scroll klik barang pas back malah kembali ke awal atas terus aja kaya gt n berat lagi jadi ribet,,negatif
mulai sekarang unistall mau berhenti jualan disini karna pembayaran tokopedia harus tunggu jam x hari baru saldo masuk seola olah hasil jualan kita jadi saham ditokopedia sellerburuk sekalidan terlalu banyak biaya penanganan biaya iniitu jadi hampir hasil penjualan dipotongparah,,negatif
kali orderan pelayanan tokopedia care buruk mau claim banyak alasan sampai seminggu tetap beralasan yang paling parah makanan dan obat ternyata bukan makanan brand malah makanan repack kiloan dan semua over claim dan palsu sampai membanhayakan nyawa orang tua saya,,negatif
tolong pisahkan tokopedia dengan tiktok shop,netral,netral
saya mesan paket ditiktok melalui tokopedia tapi barang tida sesuai dengan apa yang saya pesan dan tidak ada taggpan saat saya mengajukan pengembalian barang padahal saya benar benar berharap bahwa saya tidak ingin rugi,,negatif
kepada pihak tokpedia mohon jangan pakai jasa cicepatpihak terkait pasti sudah tau juga kan alasan nyapesanan hilang kalopun tidak hilang satu bulan baru sampai,,negatif
udah mending unistall aja aplikasi ini kapok saya pakai aplikasi ini padahal saya sudah sering transaksi pakai apliaksi ini tapi kalau ini kelewatan setelah dikembalikan auto unistall aplikasi asli parah dari customer service sampek seller tolol semua udah mending jangan belanja di tokopedia paraash,,negatif
tokopedia memenuhi semua ya dibutuhkan pokonys mantap,,positif
mantap,,positif
dulu saya suka banget belanja disini tapi sekarang jadi beda kurirnya lambat pick up pesanan seller pada cuek kalau ditanya csnya lambat dan tidak nyaman pesanan juga ada masalah,,negatif
mantul dapat harga pulsa rupiah,,negatif
aplikasi yang bermanfaat aman dan mudah digunakan hatur nuhun,,positif
oke,,positif
alhamdulillah sejauh ini saya memakai tokopedia aman saja banyak promo dn potongan harganya barang terjamin keasliannya dn keadaannya kalaupun retur cukup mudah prosesnya,,positif
tunggakan paylater tokopedia mahal bro lebih baik jangan download,,positif
mantap,,positif
oke semoga berkah,,positif
diskon nya besar sih tapi jelek nya paket ku gagal dikirim,,negatif
jadi tambah rusak tokopedia kerja sama dengan ninjaxpress pesanan saya tanggal september sampai sekarang tanggal oktober belum juga dikirim update pengiriman tidak jelas komplain sempat ditolak saya ajukan komplain lagi sampai sekarang tidak direspon penjahat lo semua,,negatif
terlalu sering ada permintaan update,,negatif
sering di telpon misterius buruk sekali pelayanannya,,negatif
paket estimasi datang tanggal mei sudah telat tiba ditambah lagi estimasinya jadi mei parah sekali ini tokopedia,,negatif
lama lama rusak ni tokopedia penarikan dana lama banget mending beralih ke toko oren dah ampun dah tokopedia,,negatif
masalah bagus up emoney keatas error update saldo saldo tidak nambah uang tidak bisa balik karena udah di tf terus uang nya kemana jir,,negatif
sedikit masukan aja tolong di kasih fitur pemilihan ekspedisinya beberapa jasa ekspedisi kadang lambat penangannannya jadi kita bisa pilih penyedia ekspedisi yang mumpuni di daerah kita,,negatif
mau redeem gift card susah amat anjg,,negatif
sudah sulit bertahan dulu suka pakai ijo sekarang jujur saya lebih puas dengan orange mhon maaf sebelumnya terima kasih,,negatif
gara gara expedisi jasa pengiriman jne aku kasih bintang tidak ada tindakan buat jasa pengiriman jne yang selalu lambat dalam pengiriman minimal teguran lah atau putus kontrak dengan mereka beli barang online selalu telat dan bermasalah kalau dianter jasa pengiriman jne,,negatif
kecewa dan sangat kecewa saya berblnja di tokopedia saya membuat pengajuan dan pngduan responnya gitu_gitu aja,,negatif
mantap murah dan original,,positif
respon tokopedia sekarang kok lambat banget sering gangguan kok lambat banget buka halaman aja tidak ada foto nya dan pokok nya lambat,,negatif
masa saya download tidak bisa,,negatif
notifnya ganggu,,negatif
sekarang susah banget hubungichat dengan penjualbikin aplikasi ko ribet bgtmakin sini ko jadi semakin kesana malah mundur padahal saya gold member,,negatif
saya suplayer batu bata merah ikut gabung buat pengiriman,,negatif
senang sekali,,positif
membuat stress gara² pencarian ngaco,,negatif
biaya admin persen dari omzet penjualan kotor itu sangat tidak manusiawi untung udah tidak seberapa di babat sama biaya admin,,negatif
pelayanan customer service semakin jelek mulai banyak toko penipuan dn penanganan masalah lama respon customer service nya pun maikin memburuk,,negatif
heran di tokopedia ini terlalu banyak pedang penipu nya ya dan seperti sengaja di biarkan oleh tokopedia mohon saran setiap selesai pengantaran tolong tombol selesainya jngn terpampang paling utama di di depan karna kita belum jelas liat barangnya keburu terpencet tombol selesai pengantaran pdhal barang yang di kirim sampah alias toko penipuan dan untuk tombol komplain di buat jngn sulit di akses sehingga memudahkan kita untuk komplain prantas pedangan penipu sudah terlalu meresahkan di aplikasi ini,,negatif
aplikasi mau cek out aja lambat tidak jadi beli aturan beli sini jadi beli ke orenge,,negatif
banyak toko tipu di retur susah skali di tokopedia ini uang blum kembali smpai sekarang,,negatif
jelek tidak bisa pesan barang pakai gratis ongkir,,negatif
bagus cepat tanggap,,positif
makasih tokopedia dan semua tim dari tokopedia kalian the best,,positif
minta di updated terus tiap buka app ngabisin data ajh bisa malah gagal terus ujung nya,,negatif
pantas harga barang di tokopedia lebih mahal krna potong untuk tokopedia dari hasil penjual nya besar banget gmna umkm mau maju wong sama tokopedia nya di peres,,negatif
membantu,,positif
saya tidak bisa mengajukan komplain sudah dipencet tombol ajukan komplain tapi terus loading tidak selesai,,negatif
customer service tidak jelas pengembalian barang tidak ada kejelasana,,negatif
kategori produk di aplikasi diatur supaya gampang dicari,netral,netral
barang rusak karna pengiriman tidak bagus tidak bisa di dikembalikan mending beli online barang yang jangan pecah belah tidak bisa di dikembalikan,,negatif
mantap,,positif
metode pembayaran lain tidak bisa digunakan dana dikembalikan tidak bisa dipakai jadi ngejogrog bae,,negatif
bagus,,positif
tolong dong lebih seleksi lagi dalam memasukkan penjual ke aplikasi ini saya kena tipu disini hp sampai sekarang tidak dateng dateng nama toko nya spade clouser emang toko anj tolong dong tindaknya coba ikutin aplikasi sebelah oyen tidak ada nipu selama saya belanja di sana sekali saya belanja disini kena tipu asw emang udah mah tidak bisa lapor lagi disini pokoknya ini aplikasi paling tidak saya suka selama hidup saya trauma saya,,negatif
akun ya lama ada yang masukin dan tiba pesen barang tanpa sepengantuhan ku masak akun bisa di masuk akun lain dan akun langsung ku tutup permanen,,negatif
sering error ngajuin kenaikan limit tokopedia card malah error terus semakin sini semakin jelek aplikasi nya error terus,,negatif
aplikasi tolol tidak ada tombol untuk batalkan pesanan chat customer service ai mulu yang jawab tidak guna nie aplikasi nyeseldownload,,negatif
seller semua pemalas tidak ada inisiatif selalu menunggu kurir bisa sampai hari minimal drop ke yang terdekat seperti klo sampai sore tidak datang klo kaya gitu sih setelah barang sampai tidak bakal saya tekan selesai biarin aja system yang selesaikan,,negatif
aplikasi bagus tokopedia,,positif
cepat banyak pilihan,,positif
membantu dan memudahkan untuk bisa memenuhi kebutuhan sehari,,positif
aplikasi belanja online terjelek dan terparah saat ini masa paket mau dihilangkan kurir dengan estimasi tiba ng wajar nga bisa di ajukan komplain mengikuti kurir tanpa ditinjau terlebihi dahulu sangat buruk harusnya kalau paket telah melewati estimasi tiba dan tertera nga wajar customer service nya bisa dihub dulu bagus semakin sini jelek parah buruk paket harusnya sampai tanggal hari h bisa diundur sampai hari,,negatif
 adil dalam memberikan diskon,,negatif
untuk chat admin susah bnerdan saldo ter endap tidak bisa di pakaikurang bagus tokopedia kalah sama yang lainny,,negatif
tokopedia tidak warah blom apa udah pelanggaranmana ongkir mahal lagi produknya juga mahalmending kalian tidak ush instal aplikasi ini dehh agar tidak menyesal,,negatif
kerenn,,negatif
parah si saya beli barang estimasi sampai tanggal sampai tanggal tidak sampaisampai udah melebihi batas estimasi kalau sekali tidak pp lah masa iya ini sampai berkalikali padahal dihari yang sama checkout di aplikasi sebelah loh mlhn pakai aplikasi sebelah duluan yang sampai padahal sama jauh dri jkt padahal sama pakai kurir jasa pengiriman jnt tpi kenapa yang di tokopedia lebih lama parah si giliran komplain ribet banget harus tunggu dulu investigasinya lama,,negatif
memuaskan,,positif
data saya di sebar monyet,,negatif
mendingan beli di toko oren dijamin tidak ada nipu barang juga bisa bergaransi,,negatif
ini sangat berguna buat saya,,positif
mantap,,positif
sudah tidak berpihak lagi sama rakyat kecilversinya sudah tidak suport lagi sama hp saya setiap mau di buka selalu terhenti membagongkan,,negatif
suka,,negatif
mantap,,positif
bagus,,positif
ya terima kasih banyak,,positif
kurir rekomendasi tp aslinya sangt tidak direkomendasikan lambat terlalu lama transit paket dioper sana dioper sini beda xpedisi kalau paket hilang tracking nya jadi susah hilang dixpedisi apa tidak bisa ketahuan karna dipickup xpedisi a di anter kurir c bahkan bisa x hanlde paket beda xpedisi contohnya dipickup jasa pengiriman jnt transit digudang jasa pengiriman jne dianter id xpress,,negatif
oke,,positif
tidak tau kenapa dengan tokopedia sekarang layanan nya sangat buruk pesan dari toko kali deres ke serpong sudah hari belom tiba juga saya komplent tidak ada tanggapan sama sekali admin tokpednya sudah jelas di lacak barang tidak bisa dikirim tpi komplenan saya tidak di proses tidak kembali kan dana,,negatif
pelayanan kirim lama sekali respon penjual juga tidak ada,,negatif
sumpah yesal saya makai aplikasi ini pesanan tidak ada update pengiriman mending pakai shopee responnya cepat klo ada apa cepat terselesaikan klo tokopedia tidak sesuai sop,,negatif
sangat asli barang nya,,positif
alhamdulillah sangat memudahkan saya dalam segala hal,,positif
mahal jirr,,negatif
mantap,,positif
jangan sampai tokopedia di tinggal pelanggan setia padahal aplikasi sebelah lebih mudah pengiriman nya mohon agar selektif lagi memilih kurir rekomendasi apalagi sap express gila itu pengiriman tidak transparan status pengiriman nya out going incoming lah tidak di jelaskan sampai mana nya keliatan tidak profesional nyalama ketika di komplain ada kurir menghubungi tapi salah pula paket yang mau di kirim nya hadeh,,negatif
bagus harga murah dan di tambah dengan banyak nya diskon,,positif
cpat dan praktis,,positif
estimasi bisa berubah sesuka hati kalau gtu tiap kali paket tidak sampai di ulur terus estimasi nya payah pesenan dari kapan belum sampe² juga di ulur terus²an udah sampai estimasi pengiriman terus ajaa diulur,,negatif
busuk,,negatif
oke,,positif
memang mantap belanja disini,,positif
serba error,,negatif
notifikasi update menyebalkan muncul terus,,negatif
semakin sini semakin banyak error nyoba instal ulang tunggu lama malah gagal instalasinya deuh beda dengan app toko sebelah simple,,negatif
keren,,positif
beberapa aplikasi tokopedia belum bisa dibuka mohon informasinya,netral,netral
aplikasi tidak rekomendasi dana kita ditahan minta foto nya dibilang blur,,negatif
banyak error masa harga piring semi melamin lusin ribu ongkos kirim nya ribu buset,,negatif
aplikasi error terus,,negatif
diskon dan gratis ongkir hilang saat mau check out buang² waktu pakai aplikasi ini,,negatif
marketplace maksa tidak bisa pilih pengiriman yang di mau harus menggunakan pengiriman pilihannya sendirii kecewa dengan rekomendasi pengiriman tokopediaa,,negatif
error mulu gagal login sama tiba keluar sendiri,,negatif
tidak cocok buat aku yang tidak sabaran katanya kode verifikasi udah dikirim nyatanya belum loading daftar lama banget,,negatif
aplikasi ini sekarang sudah update besarbesaran apalagi updatenya sangat membantu para calon pembeli tambah ternyata banyak voucher promo dan diskon ya lumayanlah saya suka aplikasi ecommerce yang satu ini tokopedia,,negatif
terima kasih aplikasinya agar mudah belanja,,positif
heran kenapa sih kalau mau buka menu pembayaran lainnya selalu tidak bisa atau tidak suka lama gitu loading nya kita mau beli tapi pengen pakai pembayaran lain masa tidak bisa benarkan tuh sistemnya,,negatif
dapat voucher rbu dengan cekout barang tidak ada voucher nya padahal dh cekout barang malah suruh cekout lagi barang gimana sih,,negatif
semakin sini semakin tidak jelastiba dibatalkan refundnya dikembalikan dimana juga tidak jelasdi chat lama,,negatif
semoga lebih ditingkatkan kembali aplikasinya,,negatif
senang belanja,,negatif
mohon diperbaiki,,negatif
baru mencoba,,negatif
fitur pepeng shoot di garena belum bisa dipakai,,netral
parah dan hancur sekarang tokopedia ini paket saya tidak sampai di sistem masih gantung lacak tokopedia care nya juga lepas tangan tidak membantu seller juga tidak memberi response kurirnya paxel menggantung lacak disistem sudah minggu dulu bisa batal sekarang dipaksa urusin sendiri tidak ada penengah saya hanya membeli dengan jujur tapi dicewain begini jangan beli tokopedia lagi lepas tangan dan masa bodo customer servicenya tokopedia carenya sangat berbahaya beli di tokopedia,,negatif
oke,,positif
suka sekali,,positif
sistem penipuan dikasih harga dari diskonnya udah jelas tapi pas mau pembayaran saya hitung kok totalnya beda tidak sesuai diskon padah udah saya unceklis biaya asuransi sama proteksi gila banget ngambil untungnya aplikasi tidak amanah voucher diskon berasa kgk ada gunanya soalnya kalau dipake harganya ya emng tetep segitu berarti kgk dapat diskon apa sialan,,negatif
buat expedisi sendiri agar lebih terintegrasi dan lebih cepat sampai,,positif
note recommended setelah gabung tok tok,,negatif
oke,,positif
susah dibuka saya posisididaerah sini,,negatif
di update malah ngelag di menu voucher nya,,negatif
bagus barang sesuai berkualitas dengan harga yang terjangkau,,positif
oke,,positif
tokopedia care yang lambat,,negatif
aplikasi mengecewakan dana dikembalikan di tarik malah pending terus gimana sih cara kerjanya,,negatif
tidak meriko mendasi lagi setelah gabung ama ticktok tambah lambat banyak toko yang biasa langganan hilang jejak tidak bisa di cari lagi,,negatif
keren,,positif
belanja mudah n untung,,positif
saya punya apl tiktok saya sering belanja melalui tiktok toko pedia ntah kenapa tiba saldo pay later di tiktok saya hilang sedangkankan saya tidak merasa transaksi ini yang ada malah timbul tagihan pinjaman ke saya saya coba hub pihak tokopedia via wa maupun customer service tidak ada tanggapan mohon bantuan penjelasannya,,negatif
apaan dah temen saya dapat diskon pengguna baru terus setiap hari lah saya kapan njir udah tunggu setengah hari tidak ada diskon sama sekali,,negatif
udah tidak seperti dulu pencarian barang dulu paling bisa diandelin di tokopedia sekarang kita masukkan nama barang a yang keluar macem macem,,negatif
pilihan produk banyak dan berkualitas dan juga pakaian ada dan bisa di beli melalui transfer atau cash on delivery,,negatif
cepat cepat agar bisa gunain paylater nya,,positif
kenapa matanya tokopedia koq berkaca kaca gitu baik saja kan ka udah jika masalah jodoh itu udah di atur yang maha kuasa ya jika masalah itu tenang saaj aja aku tidak akan pernah libatkan kalian aitu janji aku,,negatif
tiga dulu kalau bagus sayah tambah in lagi,,positif
sangat membantu app inimantab,,positif
tidak enak belanja di tokopedia tidak bebas belanja berapa unit di batasi tidak kaya shoppe bebas mau berapa unit juga selalu di review saldo penjualan lama lagi penanganan terlalu lama harus pindah jualan di toko lain ini,,negatif
gini amat yak hidup di indonesia klw belanja item bakal dapat voucher rbudah belanja itemeh voucher nya rb di bagi dong wkwkwkwk tidak ada penjelasan di sk penipuan tidak si ini namanya udah bukan marketing lagi tobatlah nak,,negatif
udah tidak ada promo besar gedean lagi semenjak collab ama tiktok,,negatif
aplikasi tidak bertanggung jawab,,negatif
mudah dan terpercaya,,positif
sukses disini saya akan beli rumah,,positif
aplikasi ampas tiba di pembayaran selalu loading lama banget malahan tidak kelar kelar loadingnya mana pelayanan tokopedia care nya lambat banget respon agen chat nya asli gondok,,negatif
dapat bonus voucher belanja rb taunya kepecah minimum per belanja besar banget nominalnya,,negatif
tidak jelas tokopediasaya melakukan penarikan dana ko malah dipersulitdana ditahan chat ke tokopediacare tidak ada balasan gmn ini solusi nya,,negatif
layanan transaksi dibatasi sudah tak bisa dibuka sudah hari saya coba sama saja malah suruh cek akun padahal barang yang mau di co banyak banget giliran mau transaksi pas bka transaksi lainnya error mulu tidak bisa kebuka semakin malas belanja disini tidak seperti biasanya semakin sini bukannya upgrade malah tmbah tidak bagus,,negatif
oke juga,,positif
menonton di snek vidio,netral,netral
terlalu ribet nembahan alamat pakai peta,,negatif
saya tidak ada aplikasi tokopedia kenapa ada kode verifikasi dari aplikasi ini,,negatif
bagus,,positif
woy knpe di update pas pesen barang toko jadi ilang cek pengiriman tidak ada order slesai juga tidak ad riwayat gmne mau ksh bintang bagus ke tokonye kl aplikasi error kye mjing,,negatif
customer service nya bot slow respon jelek banget malah mengundang penipu,,negatif
aplikasi yang keren dan profesional,,positif
gausah sok sokan tokopedia x tiktokshop,,negatif
aplikasinya bagus,,positif
update semakin kecewa di sisi sebagai seller semakin naik adminnya yang otomatis dipaksa naikin harga susah bersaing sama toko lain di sisi buyer ini semakin tidak nyaman tiap mau checkoutyang lain seringkali terjadi bugdibatalkan mendadak ini annoying banget sih update lagi semakin kecewa lagi karena customer yang masih loyal dengan segala kekurangan yang ada malah tidak dikasih voucher besar yang jarang belanja malah dapat ini pas sistem kamu gimana sih ped,,negatif
kenapa saya tidak bisa masuk akun saya,,negatif
