data,label,label_self_training
toko pedia aplikasi nya buruk lambat buka gambar saja jeda nya lama membuat jengkel dan menu buat lihat tagihan gopay later tidak ada menu nya mau gimana coba saya bayar tagihan awal,,negatif
langganan tambah saya diblokir tanpa adanya kejelasan clk cct,,negatif
dulu mah bagus tidak seperti sekarang sekarang mah banyak toko tidak jelas sering belanja dicuekin sama toko sampai batal otomatis di chat diliat doank tidak dibales membuat malas belanja nya,,negatif
alhamdulillah lebih baik,positif,positif
kenapa sekarang pesan inbox tidak bs di hapus sekarang uda bisa,netral,negatif
tolong update kan menu foto untuk memudahkan pencarian barang update keamanan terbaruuser interface tahun sebelumnya algoritma jangan selalu diubah seperti sistem sebelumnyajangan pindah ke perusahaan lain terima kasih tolong dibaca,netral,netral
admin dan customer service tokopedia lambat tidak memberikan solusi dari komplain saya sebagai pembeli yang dirugikan sudah berkalikali menghubungi customer service tapi cuma jawaban template bilangnya akan diperiksa tapi tidak sampai sekarang komplain dikembalikan barang saya masih belum ada penyelesaian,,negatif
knapa setiap transaksi tidak bisa di proses,,negatif
sangat bagus,positif,positif
oke lumayan,netral,netral
aplikasi yang terbaru mengalami crash system tidak bisa dibuka mohon kendala ini diperhatikan akun pribadi sangat penting,,negatif
tokopedia salah satu aplikasi pasar online terbaik dan saran aja kalau bisa tidak ada tuh yang namanya misteri box,positif,positif
saya sering belanja online tapi pasmau cekot ongkir mahal akhirnya saya cari marketplace yang ongkir nya murah tolong tokopedia kasi gratis ongkir dan potongan hargadong agar semangat belanjanya,,negatif
beberapa ulasan produk menunjukkan gambar yang tidak senonoh,,negatif
lumayan,netral,netral
sekarang mahal amet ongkire mhalan ongkire timbang brang yang di jual jdi malas blinya,,negatif
sudah malas belanja di tokopedia langganan buyer tambah mahal gratis ongkir pelit cashback pelit produk tidak komplit banyak toko yang cabut pindah ke shopee,,negatif
beli emoney status berhasil tpi saldo tidak masuk payah,,negatif
sangat baik,positif,positif
mantap lah,positif,positif
aplikasi online paling pelit gratis ongkir minimal belanja juta apaan coba mending pakai aplikasi oren yuk mari kita pindah ke aplikasi oren uninstall aja tokopedia fix ini harus diuninstall tidak pernah ada gratis ongkir sekalinya ada harus belanja tiga juta apalah itu dikira saya pekerja dpr,,negatif
kenapa pencarian nama barang kalau di toko ngak sesuai di ketik aneh dan juga sering juga error nge freeze gambar ngak muncul padahal koneksi internet saya normal saya di aplikasi sebelah lancar aneh ²,,negatif
aplikasi lambat,,negatif
aku kena penipuan di toko pedia ini dan akun toko saya diblokir tolong pencerahannya,,negatif
yth tokopedia tolong bantu saya dengan id prayogi putranto membelibarang berupa hp yang d kirim soklin belum saya confirmasi barang sekarang dalam proses pengajuancomplain tolong d bantu saya rugi jutaan klo sampai pengajuan komplain saya d tolak sayaharus angsur perbulan selama bln saya merasa d rugikan klo se andainya gagal pengajuan pengembalian barang,,negatif
di persulit untuk return,,negatif
oy tokopedia di pencarian terjadi buq tolong segera di fixjadi kzl saya,,negatif
mesen barang sampai jutaan udah dipesen dibatalin sama toko secara sepihak harusnya dana saya kan balik ini malah ditahan sama pihak tokopedia tanpa kejelasan apapun kapok saya belanja di tokopedia saya ngadu minta bantuan tokopediacare pun percuma yang bales ai gaakan ada solusi,,negatif
sekarang semakin parah si ijo ini masak dana dikembalikan lama banget baliknya ini udah mau jam masih belum balik ke rekening padahal uang lagi dibutuhin buat yang lain aneh sih toko oren aja tarik uang hanya itungan detik masuk kecewa,,negatif
oke kak lakukan dengan sebaik apapun itu oke,positif,positif
pas bayar suka gagal promo nya jadi ilang,,negatif
pihak tokopedia selalu merekomendasikan barang yang mengandung unsur padahal saya tidak pernah mencari barang tersebut di pencarian dan ini sangat menggangu kenyamana saya sebagai pengguna,,negatif
mantap banget,positif,positif
lebelnya hanya gratis ongkir kencur,,negatif
tolong donk buat tokopedia seringsering di cek tokotoko online yang bekerjasama masih banyak saya jumpai toko abalabal ada lapaknya tapi udah lama tidak update produknya tidak pernah online kirim chat tidak pernah dibalas stok produk masih muncul tapi begitu dibeli ternyata stok sudah habis kirim produk sering mendekati batas akhir transaksi dan lain lain tokopedia kalau tidak mau berbenah bakal ditinggal customer dan kedepan mungkin hanya tinggal nama kalah sama toko online sebelah,,negatif
oke pengiriman cepat ,positif,positif
aplikasi yang menurut ku termasuk aplikasi terbaik,positif,positif
baru ini make tokopedia pembelanjaan dari tokopedia terlalu lama paling seneb belanja pengiriman nya lama untuk proses nya di perbaiki lagi tuh tolong,,negatif
aku selalu jadi langganan tokopedia terpercaya tepat pas barang ya,positif,positif
belanja disini sering dapat barang palsuini udah kesekian kalinya saya dapat barangbpalsu dan tidak sesuai poto dan deskripsi produk apa tokopedia tidak manegur selleer nya yang dapat bintang ya udah gitu susah banget terhubung dengan customer service yang jawab pesan botkitanya tidak bisa menyampaikan keluhan secara langsungsolusi mengembalikan barang merepotkan sekali sumpah,,negatif
aplikasinya nipu harga jangan di download,,negatif
tidak usah nyantumin diskon kalau tidak bisa dipakai aplikasi scammer jangan di download,,negatif
serba mudah mantap pokona mah,positif,positif
tokopedia banyak barang palsu dan tidak asli dan barang ilegal dan tidak ada perijinan dari pajak dan bea cukaipantas negara indonesia jadi rugi sekitar rp triliun,,negatif
aplikasi sering bermasalah mengenai jaringan padahal wifi selalu normal namun server tokopedia sering tidak merespon tolong perbaiki segera,,negatif
aplikasi terbaik tidak diragukan lagi,positif,positif
berat banget ini aplikasi tokopedia sekarang dulu saya lebih prioritas tokopedia ketimbang keranjang kuning karena aplikasi nya enteng sekarang buat scroll cari barang sbntar aja udah berat hp ram padahal,,negatif
sekarang pengiriman di tokopedia jadi lambat banget,,negatif
pertama belanja semoga banyak promo dan gratis ongkir,netral,positif
sangat puas belaja di sini sukses terus buat tim pengembang,positif,positif
banyak modus penipuan,,negatif
parameter batasan keranjangnya absurd haha kalau pakai batasan item barang atau toko tidak masalah ini malah pakai batasan pcs juga efeknya ini saya pesen kertas pcs tidak bisa jadinya wkkw klik beli juga tidak bisa karena larinya kekeranjang dan pasti kena batas max pcs lagi,,negatif
saya kena tipu toko abal abal tokopedia tidak ada tanggapan buat membantu saya,,negatif
lebih baik belanja di shopee dari pada tokopedia sudah pesan bayar sudah ditunggu malah barang tidak datang tampa konfirmasi dan uang masuk ke saldo tokopedia,,negatif
barusan saya kena tipu saya wa ke no wa yang dapat dari instagram resminya tokopedia karena ada pembatalan pembelian dia nyuruh saya beli barang terus dibatalin akhirnya saya beli tapi saldonya tidak balik lagi malah ada yang ngambil di akun tokopedia punya saya,,negatif
aplikasi parah promo besar buat pelanggan tertarik dan akhirnya dibikin kecewa barang tidak pernah dikirim,,negatif
proses cepat,positif,positif
isi bagus mines notifikasi bloatware jalan mulu dan tidak bisa dihilangkan biasanya promo iklan,,negatif
mau pengembalian barang tapi kurirnya tidak datang akhirnya komplain ketutup sendiri dianggap membeli,,negatif
aplikasi aneh dan tidak laku banyak toko yang di blokir gmn mau bersaing dengan toko sebelah owner nya kelewat tolol,,negatif
saya tidak akan pernah berbelanja di tokopedia lagi banyak toko yang menjual barang tidak layak mohon ditindaklanjuti,,negatif
proses cepat dan mudah,positif,positif
kenapa ini aplikasi tokopedia mu masuk ke tagihan tokopedia card saja sudah hari tidak bisa masuk bagaimana saya bayar jika tidak bisa masuk ke menu tagihan tokopedia card,,negatif
coba benarkan lagi sistem tokopedia card nya mau bayar dipersulit ada aja alesanya seperti koneksi internetlah terus harus tunggu menit lah padahal udah ditungguin sampai besoknya tetep aja tidak bisa masa masalah kyk gini tidak hilang hilang dan masalahnya sampai berhari hari,,negatif
sekarang tokopedia aneh pertama saya beli di tokopedia bisa cash on delivery pas udah beli saya mau beli lagi udah tidak bisa cash on delivery mau beli apapun juga memang aneh,,negatif
aplikasi ini sudah milik cina pki bukan aplikasi milik anak bangsa lagi wkwk konoha indo udah dibeli sama cina,,negatif
bagus,positif,positif
kurir id express sering chat setelah kirim paket lalu meminjam uang sebaiknya pakai si cepat saja karena si cepat kurirnya sopan jasa pengiriman jne malas antar ke rumah suka minta kita ke jalan ambil di jalan utama jt juga malas antar ke rumah malas turun dari motor kita yang harus nyamperin ke motor,,negatif
sekarang jadi stupid banget fitur pencarian di tokopedia jelasjelas barangnya ada di toko dan di ketik sesuai nama barang tetap muncul barang tidak ditemukan membuat malas saja cari barang di tokopedia sejauh ini terus menurun kualitas app tokopedia,,negatif
oke bagus,positif,positif
nebar iklan di mana mana saya tidak suka,,negatif
oke baik,positif,positif
gan setelah di update fitur feed update di tokopedia nya kok tidak bisa di scroll ya,,negatif
ini dulu semoga lancar jaya,netral,netral
kok macet mau bayar,,negatif
tidak seperti dulu,,negatif
pembayaran pakai gopay saldonya selalu tidak terdeteksi padahal udah ditopup ehh saldo gopay tabungan malah yang tampil giliran di topup ke gopay tabungan ehh malah saldo utama yang tampil hal hasil saya harus bagus up dua duanya baru bisa,,negatif
terimahkasih,positif,positif
beli diskon dapat kupon event kemarenan disuruh tf dl baru dapat potonganbayar rbstlh diitung eh harga normal cm free ongkirgimik hanya beli kopi pcs jatohny satuanrbmau bangkrut cukup x ja,,negatif
koneksi timeout mulu knpa dah babhi,,negatif
aplikasi buruk sekali sudah beli pesanan tidak dikirim minta dikembalikan malah saldo pakai acara ditahan sangat menyulitkan pembeli jangan sampai ada lagi yang ketipu sama aplikasi ini,,negatif
ko akun saya tidak bisa klaim voucher sih,,negatif
error yang tidak pernah fix setiap update aplikasi ketika melihat foto ulasan geser bawah atas kanan kiri hampir gabisa perbaiki dong admin ngehambat banget error itu,,negatif
bagus,positif,positif
belanja di sini jarang yang bisa cash on delivery,,negatif
sangat baik membantu saya,positif,positif
tolong dibuat virtual account kyk aplikasi shopee bisa buat berbagai macam virtual account msal bsi bisa virtual account untuk produk krna kami mau booking dulu barang baru bayar kalau disini harus bayar dulu sdgkn kalau mau beli produk baru lagi jdi produk pertama hilang karna sdh beli produk kedua tolong diperbaiki makasih,,negatif
simpellengkapcepat,,negatif
sukses,,positif
filternya buruk tidak kyk dulu cari barang harus ulang filter terus saat kembali sortirnya juga sekarang ngawur kenapa malah jelek daripada yang dulu,,negatif
memuaskan produk paling lengkap ya di tokopedia apapun dicari pasti ada mantap,,positif
bagus mangtap minus kebanyakan error tapi oke,,positif
mantap toko pedia,,positif
keren,,positif
jika pesan barang terus kita tidak mengisi reting toko bisa otomatis mengisi sendiri wkwkwk,,negatif
sangat bagus,,positif
perbaikan yang bagus,,positif
tim tokopedia care sangat tidak profesional,,positif
cekatan,,negatif
mau tolong tambah kan fitur masukan pin dulu klo mau belanja online karena yang sekarang terlalu mudah belanja tinggal klik hanya langsung di proses nanti buat alasan costumer nge return dengan alsan kepencet kasihan orang kurirnya ini untuk di tokopedia maupun di tiktok shop ya,,negatif
semakin lemah saya cekout tidak ada respon sampai seminggu duakali ulang hadeuh parah,,negatif
aplikasi ini sangat tidak jelas dalam pelayanan maslah barang cacat sudah kirim bukti tetapi di tidak ada solusi di tambah pelayanan customer service tidak manusiawi tidak mendengar keluhan dan selalu tutup komplain ketika komplain aplikasi ini buruk sekali,,negatif
bagus hanya ongkir nya sangat mahal dari harga barang jadi total mohon di kurangi sedikit harga ongkir nya,netral,negatif
anjinglah saya setiap kali pesan kurir nya kurang ramah tidak ada konfirmasi lagi kapan pengantaran paket nya cobalah di berbaiki untuk proses pengantaran paket nya,,negatif
bagus,,positif
status pengiriman bisa dicek langsung di aplikasi,netral,netral
tidak bisa update,,negatif
fitur wishlist kadang nggak nampilin semua barang,netral,netral
mudah cepat dan praktis,,positif
hemat banget sangat membantu,,positif
tidak bisa beli pakai cash on delivery padahal sayang sekali banyak orang yang ingin beli di tokopedia karena kualitasnya dan barang barang nya bagus bagus mau beli vape pod enggak bisa beli mau jadi langganan vape pod tetapi metode pembayaran nya debit toko bagus hanya metode nya yang buruk ini saran tolong langsung di ubah langsung,netral,netral
sekarang belanja di tokopedia tidak bisa bayar di tempat,,negatif
sangat bagus trmksh,,positif
bagus,,positif
customer service tidak membantu promo yang didapat tidak sesuai cashback tidak diterima,,negatif
ongkir nya ter parah se online lainhanya bagus paylater nyabeli x barang tidak terkirim kirimtoko nya pada tidak amanahtutup saja,,negatif
gan metode pilihan pembayaran susah di buka tolong di perbaiki mw belanja jadi susah,,negatif
mau ganti nomor aja susahnya minta ampun anjg ribet hidop kamu,,negatif
bagus,,positif
jangan di install aplikasi penipu diskon saat mau beli diskonnya hilang sayangi waktu kalian pakai aplikasi lain,,negatif
banyakin gratis ongkir agar tambah maju,netral,netral
sekarang tokpedia parah yasaya komplain atas penipuan yang saya alami sudah beberpa hari tidak di tanggapi,,negatif
mantap,,positif
bagus markotop lah ,,positif
rekomendasi kurirnya tidak bagus pengiriman dekat bisa minggu lebih,,negatif
mantap,,positif
semua pelayanan sangat lambat chat penjual pun tidak ada respon penjemputan kurir sampai hari masih disuruh tunggu hari lagimasa iya proses sampai seminggu baru dikirim itupun kalau dikirim,,negatif
sip deh,,negatif
bagus aplikasinya enak di pakai,,positif
aplikasi error tambah keranjang selalu terjadi kesalaha susah buat beli produk berbeda dalam toko pengiriman tampilannya aja yang sok modern kupon promo nya juga tidak bisa dipakai alias ngibul,,negatif
saya mesen barang tiba tiba dicancel karena kesalahan penetapan hargauang saya tidak dikembalikan persen,,negatif
bagus parcaya,,positif
tolong tambahkan sisitem cash on delivery di metode pembayaran,netral,netral
menu halaman mudah dipake,,positif
pada tanggal oktober lalu saya sudah transfer uang buat beli amplifier yamaha tapi ternyata barang sdah habis lalu saya menanyakan dana dikembalikan saya tapi akun saya justru diblokirdan setelah akun saya aktif lagi saya tidak bisa melihat data transaksi saya dan dana dikembalikan saya belum dikembalikan sampai sekarang liciknya tokopedia ialah memblokir akun saya hiingga setelah saya aktif lagi dengan akun baru saya tidak bisa lihat data transaksi saya,,negatif
sangat membantu,,positif
ini gimana sih mau buka all chat malah muncul kolom rekomendasi tidak penting banget anjir mau chat seller lama gaisa diperbaiki lagi lah kamu sistimnya,,negatif
cari barang barang elektronika di toko pedia lebih lengkap lebih murah mendapatkan pelayanan terbaik,,positif
posting lebih dahulu resep search,netral,netral
sangat mudah,,positif
sangat membantu sekali dari segala proses pembayaran dan pengiriman,,positif
sangat tidak profesional dalam menangani kendala apabila terjadi keterlambatan kurir dan ternyata tidak ada jaminan bahwa barang yang kita beli terlambat atau bahkan tidak sampai tidak berubah ni tokopedia malah sekarang tidak bisa komplain memang tidak pernah menghargai konsumen,,negatif
ekspedisi rekomendasi tokopedia tidak jelas untuk tokopedia kalau mau beri layanan gratis ongkir yang niat apa,,negatif
pembayaran sekaligus error mau bayar pulsa pascabayar dan pdam sekaligus tidak bs error terus,,negatif
kecewa dengan toko pedia banyak toko penipunya mending cari yang lain aja mana malah admin toko pedia bantuin penipunya,,negatif
tidak suka banget sama sistem pengiriman sekarang tidak bisa pilih ekspedisi dipaksa pakai kurir rekomendasi masalahnya paket sering di over ke berbagai ekspedisi yang membuat paket ber putar ber putar disitu,,negatif
mantap,,positif
jujur semakin sini kok semakin banyak aja ya error nya,,negatif
opsi alasan pembatalan pembelian harusnya ditambahi barang tidak ready stock tapi ditampilkan di etalase dengan sengaja,,negatif
tidak jelas buka aplikasi mental lagi buka aplikasi mental lagi hapus tidak aja lah,,negatif
pelayanan customer service buruk pelayanan bantuankonsultasi buruk pengaduan buruk,,negatif
lumayan baik,netral,netral
admin tolong tokotoko yang sudah tidak aktif berjualan jangan di tampilkan di pencarian atau kasih penjelasan kapan terahir online penjual aku sudah cekhout berkalikali saya tunggu tidak di kirimkirim ternyata tokonya udah lama tidak jualan tolong tampilkan saja tokotoko yang masih aktif,netral,negatif
bagus,,positif
membuang uangku terima kasih tokopedia,,positif
tepat waktu,,positif
tokopedia ini gaje produk lebel gratis ongkir tp minimal jt kamu mau beli apa cokk taik,,negatif
ckp kecewa habis beli barangnya eh ternyata ad yang lebih bagus murah kenapa tidak pas ngesearch ditunjukin ya kecewa berat,,negatif
online shop terbaik,,positif
alhamdulillah puas,,positif
terima kasih tokopedia sukses selalu,,positif
aplikasi bisa dipakai buat liat barang yang lagi diskon,netral,netral
customer service chat live tidak menjawab beda dengan customer service si oren cepat tanggap,,negatif
oke mantap,,positif
saya suka belanja di tokopedia,,negatif
belanja puas tidak ada tipu saldo saya rp ribu bisa belanja lagi barang serupa yaitu jaring pagar ayam,,negatif
respon cepat,,positif
tampilan terbaru buat pencarian tidak sesuai produk yang cari saja nyusahin,,negatif
respon chat pengaduan lambat tidak lagi dah,,negatif
sangat memuaskan,,positif
tolong lah di notifikasi gratis ongkir waktu checkout g ada kuponnya tokopedia tidak se bagus yang dulu,,negatif
mantap tokopedia proses mudah dan cepat,,positif
tadi siang saya checkout langsung ada no resi ketika saya mau batalkan tidak ada fiturnya kalau sekarang saya checkout tidak ada respon dari penjual otomatis saya batalkan,,negatif
cinta tokopedia saya sangat senang banget karna harga di sini murah murah dan juga berkualitas untuk kebutuhan pc saya terima kasih banyak ya tokopedia,,positif
oke mantaasp,,positif
kapok belanja di tokopedia pengiriman melebihi batas tanggal estimasi yang di tentukan tolong kerja sama nya agar sama sama enak,,negatif
semakin banyak error salah satunya nama produk tidak sinkron contoh kamera dslr canon eos r tapi saat di klik malah masuk ke barang yang lain,,negatif
sangat baik,,positif
itur search di aplikasi bisa dipakai buat nyari barang yang mau dibel,netral,netral
bentar bentar di suruh update aplikasi klo tidak update aplikasinya tidak bisa d buka niat mau belanja malah update aplikasi sambil tunggu download kelar iseng buka aplikasi oranye kmudian nemu produk yang dicari terus cek out di aplikasi oranye selesai update aplikasi toko pedia klik keluar karena produk yang mau d beli sudah di cek out di toko oranye kata untuk toko pedia payah,,negatif
karena ada kendala pengiriman saya chat agen tapi terakhir sebelum sesi chat selesai eh tahu akun tokopedia saya logout sendiri setelah login malah semua promo ilang dan nga bisa pakai promo gratis ongkir dan lainnya padahal lagi butuh belanja di tokopedia sudah chat agen lagi tapi belum balas,,negatif
sudah lama pakai tokopedia dan merasa bagus dengan official storenya tapi sekarang kecewa karena pengiriman id express yang tidak niat mengirim barang selalu meretur secara sepihak,,negatif
sangat memuaskan mantap,,positif
bintang buangbuang waktu belanja di tokopedia pesanan tidak diproses malah tunggu habis waktu cancel by systembagusan shopee ini tokopedia tidak jelas trackingnya emang sih gratis ongkir tp kurir beda apa boleh selemot ini,,negatif
cepat,,positif
paket saya ketahan kurir ninja express udah hari plis lah tolong pengajuan pengembalian juga tidak bisa hedeh,,negatif
semakin banyak seller penipu tokopedia lambat respo hati akum ilang,,negatif
mau beli jaket harganya rebu ongkir rebu padahal sama d pulau jawa pantas aja peminat tokopedia sudah tidak ada dan pindah k shopee dan lain lain,,negatif
bagus sekali pengiriman cepat,,positif
payah tokopedia sekarang saya mau melakukan komplain sangat sulit customer service nya berteletele mau tarik saldo tokopedia dipersulit padahal saya pelanggan lama tokopedia kalau kinerjanya seperti ini bentar lagi aplikasi ini bakal punah sama toko oren sangat tidak recomended tokopedia sekarang,,negatif
suka belanja di tokopedia barang bagus,,positif
mohon lebih banyak lagi gratis ongkir,netral,netral
basa tidak sih jangan ganggu orang main game,,negatif
ada transaksi saya bermasalah dengan satu toko toko tersebut tidak mau bertanggungjawab atas barang yang rusak saya minta dikembalikan dan pengembalian dana berbagai cara minta pertanggungjawaban sama sekali tidak membuahkan hasil mengadu ke aplikasi sama aja tidak ada solusinya maaf saya kasih bintang,,negatif
tolong customer service tokopedia menertibkan seller yang tidak bertanggung jawab umumnya seller yang kasih discount kebanyakan penipu,,negatif
penampilan oke dan sangat baik dan bagus tingkatkan tpi ada kendala benar parah masa klo preorder kan sampai hari kerja ini malah lebih sampai hari kerja dan dalam po kan hari kerja saya kan butuh barang tersebut dan status nya belum berubah masih diorder blom berubah jadi dikirim ini saya minta koreksi dari pihak tokopedia untuk segera menegur oknum penjual itu tolong y tokopedia yang terhormat,,negatif
belanja di tokopedia praktis cepat terjamin dan bertanggung jawab tks tokopedia,,positif
kenapa daftar barang dalam keranjang sebagian besar hilang,,negatif
saya hamper kena tipu hati hati hp kalin di retas,,negatif
kenapa lagi ini admin tokopedia nya ada tulisannya bisa cash on delivery tapi pasa mau klik bayar tidak bisapembayaran di tempat tidak bisa di klik,,negatif
sangat mudah dan gampang dengan tokopedia,,positif
tolong error dan error nya di perbaiki di bagian pencarian nya dong,,negatif
jadi tidak nyaman sekarang belanja di tokopedia banyak error bugngetik kata kunci apa yang keluar apaongkir mahal dan lain lain,,negatif
banyak error jaringan lancar tapi tidak bisa bayar belanjaan udah lama² misahin barang eh begitu dipesan tidak bisa tolong diperbaiki,,negatif
oke lah walaupun tidak seperti shoope yang banyak gratis ongkir,,negatif
aplikasi sampah banyak toko penipuan hati buat yang lain yang pengen belanja di tokopedia banyak toko penipuan nya,,negatif
pelit gratis ongkir,,positif
baik,,positif
lagi dan lagi parah nih sistem tokopedia tidak ada perbaikan pembatalan sepihak saldo sdh kembali tapi voucher tidak dikembalikan war apaan susah dapatinnya tapi sekali dapat dipakai dibatalkan sepihak penjual kurang ajar semakin parah lagi tokopedia juga sepihak membatalkan promoudah pindah ke marketplace sebelah lebih enaksiap uninstall,,negatif
ribet amat kalau komplain di toko pedia bisa berharihari di aplikasi sebelah jam selesai diproses itu sebabnya tokopedia layak di tinggalkan,,negatif
saya ambil bintang nya lagi terlalu banyak penipuan di tokopedia saat ini saya beberapakali kena tipu ketika laporan tidak ditanggapi maaf dengan ini saya dan keluarga berhenti di tokopedia,,negatif
entah kenapa tidak bisa buka review barang ditoko lain tidak bisa mereview barang yang dibeli sudah bberapa hari ini,,negatif
saya sangat puas belanja disini banyak toko yang bagus dan bertanggu jawab serta akses pembayarannya yang paling mudah dibandingkan dengan yang lain,,positif
saya dikasi iklan dewasa mulu udah akrifkan fitur safe search rekomendasi isinya corn brator anj aplikasi tidak ramah sekali,,negatif
sisa saldo tokopedia tidak bisa ditambahkan,,negatif
tokopedia memang mantap,,positif
pengen belanja disini tapi malas kurirnya pke jasa pengiriman jne kurir paling lambat didunia apalagi kurir jasa pengiriman jne kota palu pling lambat di indonesia,,negatif
toko ijo adalah olshop yang sangat mentaati aturan iklan google tidak seperti apl² olshop sblh yang pada pasang bot autoclick iklan yang mn kita gadak klik iklan mlh terklik otomatis toko ijo ini lebih suka klik iklan yang sah n betul² diklik dengan sengaja oleh manusia tampa campur tangan bot apapun,,negatif
bagus,,positif
aplikasi nya bagus tapi sayang saya pernah pesan sesuatu dikirim lambattelat hari dan tokopedia ini tidak menyediakan gpsmap tempat berada si kurir berada jadi otomatis saya kebingungan dan pas saya cek di lacak eh malah pesanan menjauh dari rumah saya saya menjadi sangat bingung pokonya kasih solusi untuk kedepannya ya,,negatif
toko penipu dibiarkan berkeliaran agar yang transaksi di tokopedia tetap banyak parah,,negatif
baru kali ini menghadapi customer service platform belanja yang tidak niat bantu disuruh tunggu lama engga kasih solusi jawab seperti bot,,negatif
jualan di tokopedia ribet mau uploud harus ke tokopedia seller udah ke tokopedia seller harus tautkan ke tiktokbikin simple lah kaya sebelah mau tautkan atau tidak ya tidak masalah,,negatif
tidak lagi lagi dah,,negatif
kalau membuat iklan jangan maksa lah saya lagi ekspor di capcut malah tiba² ke aplikasi tokopedia padahal g mencet apa²,,negatif
mantap,,positif
