data,label,label_self_training
maaf kak yaapadahal sudah mulai suka belanja di online shopp tokopedia inipilihan productnya banyak dan harga bisa lebih murahbanyak promo dibanding aplikasi yang lain cuma tolong di perhatikan kak hampir semua barang pas mau di chekout kok selalu eror siih gangguan terus servernya ndk bisa pesan barang sllu muncul tulisan ada gangguan di topedgangguan di topedtolong di upgread lagi agar lancar sistemnnyathanks,,negatif
terimakasih bagus banget aplikasinya,,positif
loadingnya lama untuk mengganti metode pembayaran tolong diperbaiki,,negatif
setelah sekian lama akhirnya kecewa berat mending putus hubungan kerja sama sama id expres tidak profesional banget paket ditahan lama diambil di gudang gabisa kecewa poll,,negatif
sukaa banget belanja di sinii ongkir nyaa murahh murahh banyak diskonn,,negatif
bisa liat promo atau diskon,netral,netral
terimakasih tokopedia sudah banyak membantu dengan fitur paylater nya satu lagi sekedar saran admin info status pesanan sedang dikirim nya jangan pakai bahasa inggris rada tidak ngerti maksud nyapake bahasa indonesia aja jasa pengiriman juga perbanyak jasa kurir yang mendukung jangan hanya jasa pengiriman jnt jasa pengiriman jne ke bagian pedesaan banyak yang kurang mendukung jasa kurir diatas itu adapun sering lambat meleset dari estimasi,,negatif
uang ke konci semua di aplikasi ini tidak bisa di ambil tidak bisa isi saldonya pula,,negatif
tolong kak untuk vt di tiktok apa salah nya sih kak pakai gambar saya tidak punya sampel dan saya juga tidak merugikan seller mintaminta sampel saya di tiktok membuat vt bergambar akhirakhir ini di kasih poin pdhal sebelumx nya cuma di sanksi tolong kebijakan nya dirubah kak ini kok jadi takut mau berkreasi lewat vt saya cuma affiliate kecil,,negatif
pusat resolusi seperti berhadapan sama robot,,negatif
cukup membantu untuk melengkapi kebutuhan,,positif
jangan pernah beli produk digital dari tokopedia pelayanan buruk dan lama,,negatif
kembali kan uang batal belanja lamaa,,negatif
aplikasinya bermasalah slalu blk lagi mohon perbaiki,,negatif
trima kasih tokopedia,,positif
platform dengan after sales yang sangat mengkhawatirkan kalau pembelian ada masalah komplain pihak cust service dan minta bantuan selalu no respon sangat menakutkan kalau transaksi yang bernilai spt beli handphone atau elektronik yang ada harga mending cari platform lain deh,,negatif
tidak jelas mau mencari barang malah error terus aplikasi nya,,negatif
barangnya mahal diatas harga pasar gimik pakai voucher malah jadi harga normal pengguna baru tidak ada promo adapun juga harga normal,,negatif
bagus banget jirlah,,positif
mantap,,positif
jelek jangan di install,,negatif
kenapa saya tidak bisa mendownload aplikasi ini ya,,negatif
kenapa aplikasi ini jadi lambat bangetpadahal saya buka youtube lancar buka instagram buka aplikasi lain juga lancar tapi pas buka tokopedia kenapa jadi lambat,,negatif
oke bagus sekali,,positif
tokopedia semakin sini semakin kesana sering error tidak jelas tidak kaya dulu semakin berat,,negatif
terbaik emang tokopedia klo mau tarik saldo dari tokoed cepat mudah dan tidak ada biaya terbaik klo batal pun dan bisa kembali keren love tokopedia,,positif
tuempek aplikasine,,negatif
bagus banget,,positif
baru kali saya buka aplikasi tokopedia,,negatif
tolong ganti si cepat udah reting buruk memnag lambat tidak pernah tepat bad attitude parah,,negatif
saya kalau belanja di toko pedia seringnya di cancel otomatis karena tokonya yang kurang amanah tiga hari pesanan statusnya proses terus,,negatif
aplikasi sampah tidak bisa tarik saldo dikembalikan alasan email belum di verifikasi padahal sudah lebih tahun saya pakai tokopediaminggu kemarin juga bisa tarik dan tidak bisa komunikasi langsung dengan customer service nya juga paylater nya tidak bisa di pakai padahal tidak ada kendala pembayaran tidak pernah telat bayar,,negatif
mantap jiwa,,positif
pertama kali pakai toko pedia bagus up flaz tidak masuk customer service susah di hubungi,,negatif
terbaik tokopedia,,positif
bagus,,positif
kok tidak bisa beri rating ya ke penjual,netral,negatif
hai tokopedia ini saya belanja x dan semua tidak bisa saya lacak saya juga sdh bayar gimana status pesenan saya donk membuat susah aja ama yang model baru ini kembali ke yang lama aja lah,,negatif
cepat dan mantap,,positif
ongkir mahal padahal aku pengguna baru di kasih ongkir k anying,,negatif
sngat kecewa dengan jasa kurir yang di pakai tokopedia,,negatif
pelayanan cepat,,positif
error tidak bisa dibukak,,negatif
parah sih toko paling susah dikembalikan nga seperti di s l cepat banget untuk dikembalikan dan paket hilang sampai di telpon customer service juga lah di sini x dikembalikan pertama beli helm lumayan juga rb klaim dikembalikan susahnya minta ampun harus ngisi link sana sini harusnya yang ngisi link customer service malah costumer dan harus tiap hari kita chat customer service masalah refundretur udah seperti layaknya pengemis yang minta uangnya sendiri wkwk pantes aja penipuan tokokped merajalela,,negatif
aplikasi ribet mau masuk aja berteletele,,negatif
aplikasi tokopedia sekarang sangat jelek masa fitur chat dengan penjual itu sekarang susah nyarinya tidak ada lagi di bawah seperti yang dulu please lah jangan menyusahkan kita dalam berkomunikasi dengan penjual menanyakan barang,,negatif
aplikasi abalabal penjual barang banyak yang jual barang tiruan pihak ketiga juga mendukung barang tiruan wajib dilaporkan di media nasional saja agar ditutup ecommerce tokopedia,,negatif
kenapa saya tidak bisa pke tik tok paylater yaahh,,negatif
jadi lambat terus serba susah mau belanja pembayaran sekarang ini di tokopedia haduh padahal pelanggan setia lama sama tokopedia,,negatif
simple dan mudah di gunakan mantapp dah pokoke,,positif
gratis ongkir ternyata hanya ilusi,,netral
bagus,,positif
banyak penipu,,negatif
ini pengalaman pahit lagi ditoped pengembalian dana saya tidak kunjung diproses padahal setelah order lewat estimasi sudah dikomplen dan tim investigasi sudah menyampaikantapi sampai saat ini masih diulang ulangjadi barang tidak dapat uang juga tidak kembali pokoknya ribet kecewa solusi lewat tanya sudah ke chat langsung sudah terus harus kemana lagi,,negatif
olshop paling lambat pengirimannya bahkan same day pun dua hari,,negatif
lambat banget tolong perbaiki hingga mulus seperti yang lain supaya user juga nyaman,,negatif
nice and baik,,positif
bagus,,positif
serius keranjang dibatasin engga mau dibeli apa gimana sih tokopedia,,negatif
belinya cuma bisa pas ada promo,netral,netral
tokopedia kalau beri voucher sangat royal tidak kaya ecommerce yang lain sukses selalu dan jaya,,negatif
pelayanan tokopedia care hanya bot jadi jawabannya terbatas,netral,netral
ni tokopedia kenapa lagi si ko selalu ada gangguanemang server nye knpe lagi atau lambat ude gitu ni aplikasi kaya tirani masa komplain tidak boleh kata belum tentu tidakn beradab tapi perbuatan itu jelas menentukan apakah itu beradab atau tidak,,negatif
saya belum pernah,netral,negatif
apa ini mau pesan malah promo tidak berlaku habisin waktu aja buat pilih barang aplikasi kikir,,negatif
mencari hasil yang sesuai kesukaanku,,negatif
mantap,,positif
tolong dong kenapa yah mau tarik saldo dikembalikan ke rekening di reject mulu dan jumlah uangnya bukan yang kecil bagi saya tolong penjelasannya saya berharap jawaban yang membantu,,negatif
komplain barang sangat merugikan pembeli sangat lamban dalam penanganan setelah komen ini saya uninstall tokopedia,,positif
sangat mempermudah untuk belanja,,positif
menyesal setelah update bebas ongkir awalnya hanya rebu jadi rebu,,negatif
parah banget udah sebulan untuk pengembalian barang masih belum juga asli parah banget ini mendingan pindah ke shopee aja,,negatif
oke,,positif
terpercaya toko ya dan ada tokopedia cart nya itu sangan membantu dan memudahkan bertransaksi,,positif
aplikasi membuat lambat berat banget di buka nya makan ram dan jaringan nya parah,,negatif
burik lah langganan tambah saya tiba tiba dibatalkan,,negatif
aplikasi nya sudah terinstall,netral,netral
aplikasi sering logout sendiri,,negatif
pesanan tidak kunjung datang status dalam pengiriman terusbarang tidak datang datang,,negatif
bagus sekali,,positif
belanja disini sangat nyaman dan banyak promo belanja sini sangat nyaman dan banyak promo nya,,positif
tokopedia oke banget,,positif
oke,,positif
update itu agar semakin bagus app nya ini malah semakin jelek,,negatif
parah semenjak gabung tiktok,,negatif
hancur semenjak gabung tiktokaturan tiktok merugikan penjual,,negatif
g jelas waktu bayar sesuai bill setelah dibayar muncul invoice lagi dan ternyata kurang karna ada biaya layanan kenapa pas belum dibayar aja dicantumin semua bill ya aneh dan tiba pesanan dibatalkan tanpa konfirmasi karna belum bayar biaya layanan kenapa g diinfo aja sebelumnya,,negatif
mudah dipahamii dan banyak bonusnya,,positif
sebagai user saya kurang puas karena seller ada yang kurang respon di chat tidak ada balasan untuk pesanan di keterangan di proses sampai akhirnya batal sediri inisangat buang waktu,,negatif
penjual barang botot,,negatif
infonya bermanfaat untuk saya,,positif
tambah buruk,,negatif
banyak penipu dan pihak aplikasi tidak ada tanggung jawab,,negatif
mantap aplikasi tokopedia jadi hemat belanja aplikasi tokopedia serba murah murah semoga kedepannya di tingkatkan lagi ya,,positif
nyaman dalam bertransaksi dan aman,,positif
mantap,,positif
heran pesan barang di tokopedia keseringan dibatalkan sistem mau cepat malah tambah lambat jadinya kacau,,negatif
aplikasi tik pesanan sudah di nanti tapi tiba tiba di batalkan sistem tidak guna,,negatif
alur pengembalian barangnya susah ribet saya beli barang dibalikin malah dibalikin lagi sama si tokonya hesh fak u customer service tokopedia full ai,,negatif
aplikasi toko pedia jangan terlalu sering update versi data ya,,negatif
buat dropshipper kak,netral,netral
saya harap apus data saya di gopay pinjam karna data saya di tolak untuk gopay pinjam saya akan laporkan ke pada pihak yang berwajib kalau data saya di gunakan yang tidak benar,,negatif
tolong kasih keterangan seller aktif sekian hari lalu sering beli disini zonk ternyata seller tidak aktif terus mesin pencariannya udah tidak kaya dulu kalau sekarang tidak asik yang dicari apa yang muncul apa,,negatif
saya jualan di tiktokshop hasil penjualan saya dana tidak bisa di tarik,,negatif
belanja tidak nyaman dan tidak aman barang datang rusak pengajuan klaim lama bertele tele padahal sudah pakai asuransi pengiriman pun malah di tolak percuma bayar lebih tidak guna masih mending di shopee klaim gampang tidak pakai ribet sat set uang kembali barang di jemput kapok belanja di tokopedia mana barang nya mahal mahal dah lah uninstall aja,,negatif
sekarang barang serinh nyasar dan admin tokopedia tidak ada tanggung jawabnya,,negatif
gue kasih bintang karna kurang memuaskan,,positif
csnya kocak saya tanya kendala malah di akhiri chatnya ama customer service,,negatif
buruk sekali kenapa semakin sini semakin buruk tadi saya mau belanja tapi tidak jadi malah saldo dana kepotong dan tidak ada transaksi belanjanya,,negatif
mudah untuk belanja banya pilihan dan bonus,,positif
lancar transaksinya,,negatif
banyakin promo nya,netral,netral
kecewa di th ketmu penjual toko penipu bermana firman onderdil uang saya tidak balik rb respon lambat di pusat resolusi baiklah udah muak banget minggu tidak balik dana beli dari sini,,negatif
tokopedia kenapa riwayat transaksi saya hilang padahal nominal transaksinya tidak sedikit loh,,negatif
punya limit diatas jt tiba dipotong jadi jt itupun tidak bisa dipakai wkwkwk padahal tidak pernah telat bayar untung sisa tagihan tinggal dikit bayar lunas dan siap unistall,,negatif
chat sama customer service susah buka susah lagi tidak bisa malahan punya karyawan tidak ini perusahaan retur barang salah kirim dana tunggu di terima penjual baru dikembalikan alih di kembalikan di fitnah penjual barang bukan barang dia alhasil barang tidak dapat uang hilang kapok aplikasi sampah,,negatif
pusat resolusi nya lambat,,negatif
ini bahaya saya membeli barang di tokopedia kemudian barang di batalkan oleh penjual dan saldo dikembalikan saya di tarik oleh sarah siapa itu sarah saya aja tidak kenal,,negatif
sangat mudah untuk berbelanja,,positif
bisa beli apa apa aja di tokopedia,netral,negatif
update terus tp masih bynk kndalasprti mau byr aja loading terus gagal terus jdny,,negatif
alhamdulillah bagus respon dikembalikan responsif,,positif
tampilan membingungkan,,negatif
ongkir terlalu mahalaq coba langganan rb perbulan tetap kena onkir rbrb itu pun paling banyak baranglewat dari itu langsung melonjak sampai rb lebih lebih mantap pakai shopee,,negatif
pantes saja banyak yang pindah ke toko orange w beli obat di apotek online tokopedia dari tanggal sampai sekarang tanggal gada tokonya gada solusi tokopedia lemoott pelayanannya jasa ninja express mengecewakan,,negatif
mantap proses cepat bisa jadi langganan karna kualitas barang bagus,,positif
hati belanja di sini klo barang yang dikirim tidak sesuai tidak bisa di retur banyaplk penipuan di tokopedia hati,,negatif
lebih dari tahun belanja ahirnya pindah ke sopeemasa kita retur barang suruh bayar ongkos sendirienak belanja di sopeeretur tanpa bayar ongkirduit langsung balik,,negatif
da beberapa pilihan metode pembayaran di aplikasi,netral,netral
bagus banyak promo menarik sangat keren untuk tokopedia ini mantap,,positif
bsi belum bisa dipakai buat virtual account,netral,netral
pelayanan nya tidak jelas manajemen nya ancur,,negatif
mantap,,positif
oke sekali banyak voucher,,positif
komplain lambat diatasi customer service juga lambat menangani keluhan terkait pengiriman susah dapat informasi yang pasti semakin ancur aja tokopedia tidak kaya shopee lebih cepat dalam memberikan solusi dalam memberikan kepuasan pembeli saat ada kendala dalam transaksi tolong tokopedia belajar lagi aja ke manajemen shopee,,negatif
setelah diupdate tidak bisa pembayaran melalui gopay,,negatif
saya berlangganan fitur tambah tapi tidak bisa saya pakai vouchernya saya rugi sudah bayar rb tpi voucher tidak bisa terpakai pdahal di keterangan masih aktif sampai november tpi tidak bisa terpakai sama sekali ternyata di aplikasi ini suka menipu pelanggan suka mengambil uang pelanggan tidak amanah begitu pun customer service nya menjawab nya lama cuek dan jawaban yang diberikan tidak sesuai pertanyaan,,negatif
paling terbaik,,positif
mengecewakan kebocoran data yang terjadi,,negatif
puas,,positif
notifikasi udah di matiin semua masih aja tiap hari di kirim notifikasi promosi tidak jelas membuat orang kesel tidak pernah dibenerin lagi,,negatif
transaksi tidak bisa berjalan lancar,,negatif
oke sekali,,positif
layanan bagus,,positif
transaksi jadi lebih mudah dan murah dengan berbagai promo,,positif
kenapa akun saya dinonaktifkan sedangkan di dalamnya ada uang saya gimna ini tokopedia ko tidak ada respon baiknya untuk akun saya tidak biaa d kembalikan kah,,negatif
bukan nya semakin simple ehh malah error,,negatif
penjual tokopedia banyak penipuan,,negatif
aplikasi bagus,,positif
baru daptar beli tv malah di tipu di kirim kesing hp rugi banyak,,negatif
udah kelewat dari batas waktu pengiriman tapi pembeli tidak dapat kompensasi apapun,,negatif
kecewa sama toko pedia dapat kupon k malah di batal sistem kasih kupon hanya buat sandiwara doangdi pakai malah di batal sistem tidak bakal lagi beli di toko pedia penipu,,negatif
gemana cara mainya,,negatif
sangat membantu untuk belanja terimakasih tokopedia ditunggu bonusnya,,positif
bagus,,positif
sangat kecewa ya dengan admin resolusi yang cenderung berpihak pd penjual kronologi singkat saya sbg pembeli sudah mengembalikan barang ke penjual dan status resi sudah diterima tp penjual nampak manipulatif dan mengelak kalau menerima barang alhasil banding pun tidak kunjung selesai hampir satu bulan padahal semua bukti dan data konkret sudah saya lampirkan dan si admin sdh tau hasil update dari pihak kurir malah menahan resolusi tanpa ketegasan dan lambat akan saya laporan ke pengaduan konsumen,,negatif
semoga terus ada aplikasi yang sangat bermanfaat seperti ini,,positif
jangan dnload kalau tidak mau menyesal aplikasi rusak parahsering erorbarang tidak pernah sampai,,negatif
sistem pengembalian barang nya sekarang sangat ga jelas ribet banget,,negatif
untuk metode pembaya ranya kirang cepat,,positif
bagus,,positif
bagus,,positif
sekarang tidak layak penuh penipu tanpa tindakan n sgt merugikan konsumen mau hancur jangan pakai lagi,,negatif
jangan pernah beli di tokopedia banyak toko tipu² semoga play store ngehapus aplikasi tokopedia,,negatif
bagus,,positif
aplikasi semakin tidak jelas kali gagal kirim mencari solusinya mana tidak ada sama sekali nihil tolong dong bantu proses dah kali lebih bahkan ini,,negatif
mantap,,positif
benarkan dong saran pencairan nya ke barang lagi ini kalau mau mencari sesuatu saran yang muncul malah toko tidak ada barang dulu kan enak kalau mau nari barang yang saran nya barang di paling bawah baru toko tidak nyaman banget kalau mau mencari barang sekarang,,negatif
terdapat error terutama dibagian tagihan tokopedia card tidak dapat menampilkan jumlah yang akurat ditanggal terbit tagihan,,negatif
mulai saat inj tidak akan kasih bintang masalahnya ikut langganan tambah belum waktunya selesai e di hentikan ke ikutsertaan tokopedia tambah saya,,negatif
tidak bisa diakses di android,,negatif
luar biasa cepat praktis akurat,,positif
lagi viral banyak toko penipu proses pengembalian dananya ribet harus ini itu tae,,negatif
mantap toko pedia,,positif
saran untuk tokopedia kalau pembayaran jangan dipersulit pembayaran sangat terbatas ribet kalau beli pulsa pulsa untuk pengguna baru karena harganya pulsa rb bayar rb setiap kali bayar malah pesanan dibatalkan ini penipuan apa gmn terus pembayaran ribet kalau nomor danagopay beda dengan nomor yang akan di isikan pulsa harus verifikasi lagi inilh kenala lebih suka belanja di aplikasi shop lain padahal diskon tokopedia udah oke tpi medote bayarnya membuat ribet pol,,negatif
saya sudah daftar tapi pas mau beli malah dusuruh membuat akun lagi,,negatif
sangat membantu,,positif
udah bahaya sekarang tokopedia no konsumen sekarang tidak aman banyak modus penipuan lewat wa minta qr dri expedisi,,negatif
pelayanan bagus,,positif
oke lumayan bagus,,positif
senang dan percaya dengan tokopedia mantap,,positif
saya hanya nagih janji admin tokopedia yang mau memberikan kompensasi yang janji diproses hari setelah hari saya tagih lagi janjinya tidak ada penyelesain dan saya diblokir dichat online sekelas tokopedia penyelesain masalahnya seperti gni lebih baik pindah di aplikasi sebelah,,negatif
penanganannya lambat barang salah kirim toko sudah menyetujui untuk dikembalikan tapi admin tokopedia belum juga ada keputusan,,negatif
mengapa ada aplikasi saat mendanload,,negatif
lambat dalam penanganan masalah,,negatif
semakin sini semakin lemotberat aplikasi nya dan semakin berkurang diskon promo,,negatif
marak penipuan susah return,,negatif
banyak penipu berkedok penjualan dan tiba tiba saya menunggu konfirmasi di pihak tokopedia nya malahan pagi tokopedia saya tidak bisa d buka dan ke hek org minta suulusi email belum ada respon,,negatif
lewat web bisa masuk tp lewat aplikasi selalu di suruh ganti password padahal akun baru akun lamajg tiba ilang tokoed jadi aneh sekarang,,negatif
nama saya dan alamat dipakai oranglain untuk pengiriman cash on delivery yang tidak sama sekali saya order nomor hp pemesan tidak jelas report ke customer service tidak digubris sama sekali,,negatif
aplikasi mudah dimengerti membantu kita belanja online yang super cepat,,positif
terimakasih,,negatif
aplikasih dajal saya beli barang tapi tidak sesuay terus shopee dari pada aplikasih tidak guna,,negatif
recommended seller jangan ragu beli di toko ini recommended seller,,negatif
tidak ada gratis ongkir wooii mahaall paling enak emang aplikasi oren,,negatif
algoritma mu ini sampah kali tokopedia masak akun ku di spam produk padahal selama ini di tokopedia cuma search dan beli halhal yang berhubungan ama gaming,,negatif
belanja nyaman aman terpercaya sudah sering memanfaatkan layanan tokopedia ini semoga tetap menjaga layanan tetbaik bagi penggunanya,,negatif
sekarang jelek banget ini aplikasi tokonya pda jarang aktif eh voucher nya jga hangus padahal batal otomatis ini udah lebih dari kali sering ngebleng banget,,negatif
oke banget semoga awet,,positif
aplikasinya error aneh banget,,negatif
cuk susahnya masukin keranjang selalu kesalahan server cuk cuk,,negatif
aplikasi belanja paling parahterutama jika expedisinya id expresberminggu baru datengkomplain tidak bisatokopedia lepas tanggung jawab tidak responsifbahkan sangat susah,,negatif
gamau tau pas ada kesalahan sistem malas sama tokopedia gratong nya juga gaada berkali kali bilangnya ada gangguan dintumah tokopedia tidak dijelasin lagi busuk,,negatif
ya masukan tokopedia mau belanja senapan cobra,,negatif
oke bagus,,positif
tidak profesional barang di co hari tidak proses padahal tu barang masih dijual dietalase mentang harga promo enak banget bilang stok abis,,negatif
sangat direkomendasikan untuk beli barang electronic,,positif
tidak bagus untuk di gunakan,,positif
maaf saya kasih dulu sebab untuk halaman bagian voucher plushalaman tokopedia care untuk menghubungi agen cfs gagal dimuat untuk redmi a sebelumnya saya pakai samsung a karena samsung a saya sedang ada kendala akhirnya saya pakai hp redmi a untuk device cadangan sayang sekali halaman tambah voucher gagal ditampilkan khususnya untuk voucher tambah diskon rb tanpa admin belanja semoga kedepannya bisa lebih baik lagi walaupun aplikasi dipakai untuk device android versi lama terimakasih,,negatif
dulu asik bner banyak cash backnya sama gratis ongkir bneran nolong sekrng semakin hari cash back sulit ongkir nya juga tinggi di tambah yang murah kadang tidak bisa kirim dngan alamat tidak kurir woy saya tinggal dikota palembang bukan plosok aneh benar aplikasi ini,,negatif
saya donlod aplikasi tiktok sheller jadinya hampir tiap hari di telepon csnya telpon tidak diangkat besoknya nelpon lagisudah satu minggu ditelpon customer service tiktok sheller jadi tidak nyaman,,negatif
belanja online komplit cepat murah mudah dengan berbagai sistem pembayaran,,positif
paket selalu telat datang bisa dalam waktu hari atau lebih,,negatif
dikembalikan dana lama tolong diperbaiki,,negatif
pengiriman lambat tidak bisa pilih ekspedisi juga tolong diperbaiki,,negatif
oke cepat,,positif
bagus,,positif
saya sebenarnya dulu suka sekali dengan tokopedia sering saya jadikan marketplace utama ketika berbelanja tapi ada kejadian lupa bayar gopaylater rb akun langsung di blokir padahal denda sudah di bayar itu pun tanggal sudah clear malas lah sekarang pakai sekarang pindah aplikasi toko oren bisa beri limit x lipat dari yang di kasih gopay saking percaya nya toko oren terhadap pelanggan bye tokopedia,,negatif
keren,,positif
aplikasi sedikit bisa membantu yang sesat di jalan,,negatif
mau pesan promo nya hilang gila benar,,negatif
sangat baik,,positif
diskonnya waktu beli hilang diskon buat pemanis aja,,negatif
woi tampilan nya kenapa berubah ubah saya jadi bingung bayar gopay later,,negatif
tokopedia kalau komplain barang minta retur lama banget proses nya harusnya kalau retur makanan seperti coklat jangan lama udah mau minggu baru di proses minta di kirim ulang barang nya mana coklatnya gampang meleleh tidak semua orng punya lemari es oi gue pesan coklat pcs yang datang hanya pcs mana harganya mahal rb yang datang hanya coklat kecil² hanya mending beli silverqueen yang kg,,negatif
pinjemin dana,,negatif
sering error tidak bisa dibuka di hp pdahal udah sering update juga,,negatif
banyak keuntungan transaksi dipermudah kredivo tiktok dan lain lain terima kasih tokopedia,,negatif
promo kadang tidak bisa dipakai,,netral
admin tokopedia sekarang kurang bisa diandalkan saya komplain dari tanggal september sampai sekarang tidak ada kejelasanbeli barang kelihatan dikemas dan dikirim selisih jam langsung selesaibegitu dikomplain barang belum diterima oleh pembeli dari penjualnya menolak dikomplain dan kurir tidak di investigasi karena tidak ada foto penerima dan foto resinya jawaban juga ber putar dari admin dan ini mencari kelengahan dari pembeli supaya pesanan komplain selesai jadi harus selalu update,,negatif
saya sering belanja dari tokopediaalhamdulillah barangnya bagusbagus dan murah dan cepat sampai sesuai dan pengiriman nya cepat sesuai perjanjian kirim tterimakasih tokopedia good luck dan semoga selalu amanah,,positif
memudahkan dan sangat membantu penjual dan pembeli,,positif
banyak seller penipu di sini dan proses pengembalian dana nya berteletele dan ribet tidak ada solusi sama sekali,,negatif
lengkap dan terpercaya,,positif
bagus,,positif
baru aja saya mau bayar tagihan lewat tokopedia ternyata gagal transaksinya dan katanya dana refun tp dananya keterangannya sedang proses review belum masuk sedangkan saya butuh uangnya komplain customer service percuma lambat g respon masa dikembalikan uang makan waktu lama kemarin transaksi gagal juga tp lsgsg balik saldonya la hari ini licik banget giliran besar balikinnya lama banget uang saya,,negatif
baik,,positif
akun saya tiba tiba no hp nya ganti terus berkas berkas transaksi ilang semua aneh emng tokopedia ini paling aman ya shopee,,negatif
error terus menerus,,negatif
ribet,,negatif
saya tidak lagi menggunakan aplikasi ini kerena proses pengembalian barang yang tidak masuk akal setelah melihat kasus tas touring yang juta jadi bye bye pindah ke oren,,negatif
tim tokopediacare nya saya kurang puas dengan kinerjanya sangat lama menyelesaikan masalah nya tolong hargai tiap customer,,negatif
mantap,,positif
tolong adain fitur percepat pesanan ke jasa pengiriman dishopee udah dari dulu barang stuk disitu mau komplain ribet harus tunggu hari h note saya bintang agar kalian bisa bacalikemuncul diulasan kalian,,negatif
terimakasih sudah memberikan pelayanan yang baik,,positif
cinta tokopedia,,positif
