data,label,label_self_training
semakin kekini semakin payah,negatif,negatif
update mulu,negatif,negatif
aplikasi ini pengiriman lambataturan di membuat sendiri dan dilanggar sendiri tidak ada jaminan pengiriman tepat waktu,negatif,negatif
baik,positif,positif
error buka aplikasi terlalu berat di awal udah kaya download ribuan mb,negatif,negatif
tidak bisa memilih metode pembayaran selain yang utama seringnya error,negatif,negatif
pengiriman lama mau komplain tidak bisa,negatif,negatif
aplikasi lambat perbaiki kalau tidak kalah sama aplikasi lain yang lebih lancar amin,negatif,negatif
smua informasi jelas,positif,positif
tidak bisa login aplikasi aneh,negatif,negatif
knpa kdang lambat,negatif,negatif
mantap,positif,positif
kenapa setelah update malah jadi error tidak bisa dipakai aplikasinya kenapa bisa begitu malah disuruh update lagi dan lagi,negatif,negatif
banyak gaya pakai diskon tapi pas mau beli di hilangin diskonnya,negatif,negatif
dana saya sudah hari belum dikembalikan padahal yang batal pihak toko kecewa dengan tokopedia,negatif,negatif
tidak amanah saya belanja ditipu sampai saat ini belum ada pertanggung jawaban oleh pihak tokopedia pelayanan sangat tidak manusiawi,negatif,negatif
ribut pusing tidak tau ah mau bilang apa cuma belanja lancarlancar aja siih ada semua dari segi faedah lainnya bayar bank sulit dah pakai vitual bank juga susah amat pusing,negatif,negatif
bagus promo nya,positif,positif
semakin berat aja ini aplikasi semakin ke sini semakin ke sana lol,negatif,negatif
tempat belanja aman mudah terpercaya,positif,positif
bagus lancar,positif,positif
bagus,positif,positif
aplikasi harga paling mahal di indonesia ni tidak seperti shopee dan lazada gratis ongkir dan cash on delivery bisa ada potongan harga lagi,negatif,negatif
sangat membantu,positif,positif
ongkir keren kualitas bagus,positif,positif
sebenarnya aku sering pakai tokopedia tapi akhir ini tidak bisa dibuka sering minta update dan gitu terus gimana solusinya,negatif,negatif
sangat membantu sekedar saran kalau bisa di tambah kan menu untuk mengatur harga jual pulsa di struk seperti aplikasi mitra tokopedia dulu,positif,positif
mau tarik saldo dikembalikan malah keluar dari app terus stlh itu buka app nya saja tidak bisa otomatis keluar dari app terus,negatif,negatif
bagus,positif,positif
aplikasi tidak jelas mending aplikasi si oranye,negatif,negatif
banyak error ui berat spam notifikasi tidak berguna tiap hari selalu ada sisanya bagus,negatif,negatif
kecewa sih sama tokopedia jt aku isi alamat sudah jelas lengkap pinpointnya sudah jelas kodepos nya juga benar tapi dapat sms dari pihak ekspedisi kalau tlckecamatan salah dan barang bakalan diretur padahal udah lengganan lho sama jt saya isi alamatnya juga sudah benar kecuali kalau ngisi form alamat seperti di shopee pasti ada kesalahan saya beli barang dapat diskon yang lumayan yaa kalau nanti pas diretur order kembali dapat harga diskon kalau tidak jelek jangan belanja tokopedia,negatif,negatif
semakin sini malah tidak ada gratis ongkir nya,negatif,negatif
mantap,positif,positif
sangat memuaskan,positif,positif
cash on delivery tidak bisa jelek,negatif,negatif
bagus,positif,positif
memuaskan,positif,positif
kok sekarang semakin berat aplikasinya upload foto atau video singkat untuk beri ulasan susah upload nya cari sesuatu di kolom pencarian juga yang muncul koneksi timeout kode error padahal untuk aktifitas buka aplikasi lain lancar jaya hanya aplikasi ini yang berat,negatif,negatif
jelek ribet,negatif,negatif
belakangan sering kecewa belanja di tokopedia pelayanan dari pusat resolusi sangat payah komplain mesti tunggu berhari baru direspon,negatif,negatif
semenjak update udah tidak bisa jualan barang lagi sistem nya semakin ribet padahal setiap barang yang laku kita dikenakan potongan kurang apalagi coba,negatif,negatif
mending tidak sah promo klu sama aja bo ong wkwk,negatif,negatif
puas dengan aplikasi tokopedia gratis ongkir,positif,positif
luar biasa,positif,positif
jelek cuih,negatif,negatif
sangat membantu kebutuhan rumah tangga mudah dan nyaman belanja di tokopedia,positif,positif
keren,positif,positif
tokopedia suka nahan nahan dana saldo yang mau ditarik,negatif,negatif
baik,positif,positif
bagus pokoknya mantap,positif,positif
kenapa tokopedia jadi jelek gini yah pesenan tidak gercep di tanganin lama di kirim proses sampai berahir batal otomatis,negatif,negatif
banyak penipuan di aplikasi ini dan tanggapan pihak aplikasi nya sangat mengecewakan sampai sampai dan yang di bayarkan belum juga kembali,negatif,negatif
saya suka tokopedia namun kelemahannya dia tidak punya expedisi sendiri sehingga ongkir mahal dan proses pengiriman sangat lambat semogah tokopedia segera mempunyai ekspedisi sendiri seperti ecommerce lain dan bisa bersaing dengan cepat nya pengiriman paket atau paling tidak membeli saham expedisi yang mati suri supaya menjadi customer prioritas,negatif,negatif
sistem layanan sampah,negatif,negatif
pengiriman sangat lambat,negatif,negatif
berat betul aplikasinya sekarang banyak error lagi,negatif,negatif
update yang terbaru ini parah tidak bisa transaksi dan buka menu yang lain macet mintol di update lagi dong,negatif,negatif
sekarang lama dengan aplikasi ini pengiriman dengan yang terterah tidak sesuai tulis hari saya pny barang sdh minggu di ekpedisi tidak di antar padahal sama kota,negatif,negatif
sangat mudah untuk transaksi belanja,positif,positif
metode pembayaran semoga yang saya beli bermanfaat,positif,positif
cepat dan amanah,positif,positif
proses sudah filter masuk item kembali filternya selalu balik ke awal,negatif,negatif
seneng sebenernya ini pembelian pertama udah di kasih banyak diskon diskon spesial sama gratis ongkir ,positif,positif
media pencarian kacau,negatif,negatif
aplikasi lebih disederhanakan,netral,netral
di update bukanya bagus lancar malah berat aplikasinya aplikasinya di buka kluar sendiri parah benar apalagi promo nya admin belanja ratusan baru dapat promo mau hps akun ja dah tokopedia khusus hp klas atas hp kentang tidak mendukung mungkin klo ada versi lite kukasih bintang,negatif,negatif
tadinya upload gampang dan mudah sekarang sudah tidak bisa upload disuruh konek ke tiktok tapi sudah di konek tapi tidak bisa katanya tidak memenuhi syarat padahal sebelumnya amanaman aja jualan disini,negatif,negatif
asli tidak jelas akhir ini mencari barang selalu dikasih lihat barang yang sama berulangulang produknya hanya itu aja seolaholah hanya di dominasi sama toko aja tidak jelas,negatif,negatif
bagus sih mudah di pakai nya tapi kenapa yah fitur paylater saya tibatiba sekarang susah di pakai dan fitur paylater nya malah jadi non aktif sendiri kira² kenapa yah nanti balik lagi kalau fitur paylater saya udah kembali aktif lagi entah salah nya di manah padahal tidak pernah telat dah perasaan,negatif,negatif
saya menerima barang palsu dan ketika pengembalian barang return ke penjual tidak sampai sampai ke tangan penjual sehingga saya tidak dapat menerima uang saya kembali layanannya jelek dan tidak bertanggung jawab,negatif,negatif
tokopedia nyaman dan banyak pilihan produk tapi akurasi lokasi kadang kurang tepat estimasi ongkir dan pengiriman jadi kurang akurat semoga fitur lokasi bisa lebih presisi supaya belanja semakin mudah dan cepat,positif,positif
sangat recommended untuk berbelanja online,positif,positif
lacak status paketnya kurang lengkap tudak di jelaskan sudah sampai mananya,negatif,negatif
tolong tingkatkan lagi untuk kurir nya klau bisa pakai sicepat agar cepat pengiriman nyah,negatif,negatif
respon cepatbagus sekali,positif,positif
bagus banget,positif,positif
pengiriman ekpedisi berhari membuat barang telat hub customer service kurir atau tokopedia ga jelas hanya suruh sabar pelayanan kurir yang telat mohon dievaluasi kita juga bayar loh untuk kirimanya tidak cm free saja tolong cek lagi kurir ekspedisi yang selalu lewat batas kirim kalau gini terus konsumen rugi tunggu rate toko juga malah jadi jelek karena kurir lama jangan sampai tokopedia di unistall gara layanan kurir yang lama tolong di perhatikan bukan hanya nanti di evaluasi tapi aktual tidak ada perubahan,negatif,negatif
mantap mudah untuk transaksi,positif,positif
oke barang bagus,positif,positif
murah,positif,positif
tolong diperbaiki,negatif,negatif
seperti aplikasi yang tidak terurus sejak di ambil alih sama tiktok semakin ancur aplikasi ini sebagai seller dan buyer cukup kecewa dengan keadaan tokopedia sekarang,negatif,negatif
semoga semuanya menjadi banyak manfaat khairun nasi anfauhum linmas thank you friend,positif,positif
hoax bukanya dapat harga murahmalah semua voucher tiba tiba ilang,negatif,negatif
sekarang semakin buruk tidak bisa posting ulasan mana tidak bisa login pula tapi msih lebih bagus dari shoope,negatif,negatif
aplikasi nya sangat bagus,positif,positif
fiturnya dikembangkan dong kaya ecommerce sebelah jasa pengiriman masa random tidak bisa pilih sesuai pembeli tidak ada pilihan kurirnya payah,negatif,negatif
saya sudah kembali kan barang ke toko karna barang tidak sesuai terlalu ribet pengembalian saldo nya jangan belanja di toko pedia lagi teman teman saya kecewa bayak toko yang tidak amanah di toko pedia hati hati klo belanja online mending belanja di toko langsung lebih aman,negatif,negatif
g jelas koneksi timeout mulu kalau mencari barang harus di refresh baru bisa heran ini error kah,negatif,negatif
banyak iklan mengganggu,negatif,negatif
mantap,positif,positif
keseringan update setiap dibuka minta update kalau tidak di update app tidak kebuka maksa banget,negatif,negatif
bagus,positif,positif
sumpah lumayan ribet pakai tokopedia sameday katanya sampai satu hari sudah dua hari masih belum sampai ongkir mahal voucher sangat terbatas,negatif,negatif
kacau data saya bocor,negatif,negatif
mantapp,positif,positif
sering lambat dalam membuka bagian keranjang dibandingkan aplikasi belanja lainnya bagian menghubungkan dengn dana gopay ovo dan lain lain sms sering terhambat dan gagal kirirm sms,negatif,negatif
bagus,positif,positif
ini gimana ya aplikasi nya kok waktu udah checkout tidak bisa di kensel ya padahal belum ada jam terus tempat censel nya kok tidak ada ya padahal biasa nya ada kecewa berat sih,negatif,negatif
kali belanja di tokopedia selalu meleset estimasi pengiriman nya kalah jauh dengan platform sebelah fitur tanya pun tidak pernah bisa selesaikan komplain,negatif,negatif
dana pengembalian tidak msk rekeningku buruk skali,negatif,negatif
aplikasi nya bagus,positif,positif
saya kira beli online itu murah tau nya mahal juga mana ongkir nya hampir sama dengan harga nya parah,negatif,negatif
sangat baik,positif,positif
sistem pelayanan mudah dan cepat,positif,positif
mana fungsi untuk bagus up saldonya bingung tidak semudah platform platform sebelahnya ada yang berhasil tapi pakai cara khusus ya kali tiap mau bagus up harus pakai cara yang seribet itu tolong pihak aplikator untuk memasang fitur yang memudahkan usernya untuk melakukan topup setelah terealisasi baru nanti bintang,negatif,negatif
coba belanja di tokopedia,netral,negatif
murah semua harganya ss,positif,positif
saya pernah kemarin pesan minyak kayu putih cap ayam sudah dibeli tidak bisa cash on delivery akhirnya saya transfer tiba tiba uangnya dikembalikan dari tokonya tidak tau apa permasalahannya dan sama sekali tidak ada konfirmasi dari tokonya,negatif,negatif
banyak penipuan mending shope chat admin tidak ada solusi,negatif,negatif
pokoknya tokopedia mantap lah,positif,positif
mantap,positif,positif
kurir patnernya pada lambat banget tiap pesen barang selalu telat nyampenya tidak sesuai estimasi,negatif,negatif
sering error kenapa ini di update semakin sini semakin parah erornya,negatif,negatif
gampang freeze kalau mau checkout,negatif,negatif
aplikasinya panas menguras baterai,negatif,negatif
jasa pengiriman paket nya terkesan lambat dan tidak proporsional sehingga membuat pengiriman paket saya menjadi sering tertunda dari jadwal yang seharusnya padahal jarak rumah saya masih berada di dalam kota yang sama dan hanya karena masalah tidak nemu alamat langsung di kembalikan ke pengiriman ulang padahal jaraknya dekat,negatif,negatif
kenapa tokopedia sekarang kurang jelas dalam komplain barang dan return padahal dulu bagus dan cepat sekarang hampir bulan dari september sampai oktober belum ada kejelasan dan tim tokopedia care hanya memberi pesan menunggu dan tetap mengoptimalkan sampai saat ini tanpa kejelasan kendala apapun dimohon untuk tim tokopedia lebih mementingkan pihak costumer dalam berbagai kendala dalam jual beli semoga dari pihak tokopedia menindak lanjuti problem ini dan masalah costumer lainnya,negatif,negatif
saya beli dek lumpur vario sampai sekarang belum sampai saya sudah komplin ma tokopedia dan mau diinvestigasi tanggal sampai sekarang kejelasan penanganan komplinnya belum jelas barangnya sudah dimana belum jelas dari ekspedisinya juga sama tidak jelas jawabannya apa perlu berbulan bulan menangani maslah ini,negatif,negatif
aplikasi tolloll,negatif,negatif
parah dikembalikan uangnya tidak kembali full najis,negatif,negatif
bank bunga cicilan malahan tokopedia memakan uang pelanggan dengan biaya layanan parah kalau hubungi pihak bank dengan pihak pembeli kalau dibagi bulan bulan bulan bulan itu urusan bank dengan pembeli dan konsumen tidak ada hubungan dengan tokopedia tokopedia hanya menerima pembayaran total nya saja nampak x tokopedia sekarang kurang peminat garagara dibuat makan uang pembeli biaya layanan,negatif,negatif
aplikasi sampah tidak bisa pakai bebas ongkir,negatif,negatif
menyesal beli tokopedia tambah hanya buat jawa aplikasi jelek tidak seperti shopee yang seluruh indo,negatif,negatif
mau verifikasi aja susah banget,negatif,negatif
proses cepat,positif,positif
sehabis dari transaksi pertama saya masuk lagi mau belanja cari barang dapat barangnya masuk keranjang tiba ada voucher yang ntah itu voucher apa aku pakai tapi setelah aku pakai kok ky error keluar masuk lagi kirain bakal normal sekarang jdi tidak bisa lagi pke voucher apa selain voucher dari toko sumpah berasa kena jebakan klo tahu gtu mah tidak bakal aku pke itu voucher tidak jelas tokopedia freak sistem,negatif,negatif
tokopedia bangke nyusahin driver online krna titik tidak pernah akurat,negatif,negatif
lebih banyak pilihan baik jenis barang merk ukuran harga juga ekspedisi banyak tinggal pilih saja,positif,positif
oke cepat prosesnya,positif,positif
jelek banget sumpah sinyal udah g penuh paket data mash gb pas buka buat bales chat transaksi atau pilih pembayaran selalu tidak ke load ujungujungnya gagal ampas apps nya,negatif,negatif
diskonnya banyak murah murah cuma masalahnya saat mengisi alamat pengiriman disuruh nulis kode pos sedangkan untuk kolom kode pos tidak ada tolong diperbaiki secepatnya,negatif,negatif
beli pulsa listrik d tokopedia dri kmren mlm smpai saat ini tokena blom adastatusa masih mnunggu konfirmasi toko menyesal bagtz dh belanja d tokpedmendingan belanja d shoope sekalian,negatif,negatif
cobain dulu baru komentar,netral,netral
mau chat sama live agent aja susah minta ampun,negatif,negatif
bagus,positif,positif
ini belanja banyak kurir sicepat tidak ada solusi malah tertahan jam lebih hampir hari sedang estimasi sudah lewat gimana konsumen mau nyaman bro konsumen butuh solusi agar tidak kyk gini pengaduan malah bicara sama robot ngotak tidak kalian tokopedia,negatif,negatif
sekarang tokopedia tidak bisa ngajukan komplain udah hari barang tidak datang padahal jaraknya malangsurabaya yang normalnya hari mau komplain tunggu besok udah besok tunggu lagi besok gitu aja seterusnya udah tanya ke tokopediacare tapi jawabannya tidak jelas dan tidak ada solusi kayaknya mulai pindah aja sih ke toko oren ketimbang ini padahal udah langganan tokopedia tambah setahun lebih,negatif,negatif
minimal jelasin lah itu ke saya kenapa fitur tambah saya di blacklist padahal saya tidak ngapangapain udah aaya laporin di email tidak di jwb di customer service malah tidak jels,negatif,negatif
aplikasi nya kurang memuaskan tidak ada diskon soalnya aku mau beli buku harga rb diskon tulisan nya pas mau di co rb hdh,negatif,negatif
semakin buruk aplikasinya,negatif,negatif
aku dapat resep dokter gratis,positif,positif
terlalu sering update sangat mengganggu dan lambat juga memakan memory media,positif,positif
tambahkan fitur rating kurir agar rating pengiriman tidak tercampur dengan rating barang apakah perusahaan besar ini membaca saran kecil ini,netral,netral
gara gara di tautan sama tokopedia tiktok saya tidak bisa digunakan playater nya sedangkan tokopedia belum pernah belanja,negatif,negatif
belanja banyak harga semakin mahal masa harus belanja satu satu kalah sama toko orange yang langsung sameday belanja banyak tidak berubah lagi harganya,negatif,negatif
maaf saya kasih bintang karena aplikasi nya tidak bagus setiap mau di pakai harus daftar ulang buat masuk hari ini tanggal say mau uninstall aplikasi nya saya tidak ada pinjaman apapun di sini tidak belanja apa di sini jdi saya tidak punya cicilan apapun,negatif,negatif
masuk ke pembayaran muter² terus udah sering seperti ini internet lancar di aplikasi lain lancar,negatif,negatif
mohon diperbaiki error,negatif,negatif
apa hanya di saya saja tokopedia ada biaya ongkos kirim setiap belanja padahal dulu saya sering dapat banyak voucher diskon dan bebas dari biaya ongkos kirim,negatif,negatif
tokopedia jika tidak dibenahi mulai dari harga dan seller suatu saat akan jadi cerita saja,negatif,negatif
tidak sengaja keluar akun eh pas mau masuk lagi malah tidak bisa,negatif,negatif
banyak seller tidak bertanggung jawab sudah dapat flashsale malah dibatalkan secara sepihak kalau memang tidak mau barangnya ikut flashsale tidak usah didaftarkan flashsale malah pembelaan dikira bukan flashsale makanya dibaca lalu untuk customer service tokopedia tidak membantu sama sekali user sudah buang tenaga waktu uang setelah ada kejadian malah tidak mau memberikan solusi yang sepadan user susahsusah harus ini itu kalian cuma mau enaknya saja perbaiki kualitasnya,negatif,negatif
kebanyakan barang tidak ada metode cash on delivery padahal cash on delivery lebih mudah dan praktis,,negatif
jelek banya error bisa bisanya voucher ada tapi tidak ad satupun yang bisa di pakai mending apus membuat hp jadi bert event bedug juga di hp ram sering macet layrnya hrus restar paksa pke tombol power masih ringan shopee ori di bandingin tokoped,,negatif
mantap,positif,positif
ngadain program flasale cuma pembohongan publik sudah dapat promo di batalkan customer service tokopedia vs seller saling lempar masalah tanpa ada solusi yang baik,,negatif
saya nyaman dan terpercaya belanja di tokopedia,positif,positif
tidak bisa kirim vidio via chat tokopedia jai kalau mau komplain susah karna peraturannyaapalagi kirim link arau nomor resi tidak bisa,,negatif
aplikasi ini bagus banget ya semoga bermanfaat ya aplikasi ini,positif,positif
belanja banyak tapi tidak ada potongan gratisan ongkir itu gimana coba anehh banget,,negatif
bagus tokopedia mudah di gunakan,positif,positif
kalau banyak promo bintang akan bertambah sendiri,netral,netral
toko pedia kebanyakan toko penipu terutama toko jualan spedahapakah tidak bisa di hapus toko tersebut,,negatif
bagus sekali memuaskan,positif,positif
sistem pengiriman paket lamajauh dari estimasi,,negatif
admin tolong tambah kan map dong agar bisa tau paket nya dah dimana plis,netral,netral
mantap baik,positif,positif
bagus,positif,positif
bagi saya sekarang belanja di tokopedia jauh dari kata menyenangkan penjual terkesan sangat malas menjawab pertanyaan via tokopedia chat bisa dua hari kemudian baru di jawab bahkan sering kali tidak sama sekali beberapa produk yang di jual tidak mengedepankan kualitas alhasil saat dikembalikan konsumen semakin dirugikan dengan biaya pengembalian yang sepenuhnya di tanggung konsumen semoga belanja di tokopedia dapat kembali menyenangkan seperti dulu,,negatif
beli di tokopedia dan dibatalkan pembeli uang tidak kembali kepotong rupiah aneh,,negatif
pengembalian dana lambat padahal pesanan belom dikemas seller juga pada afk no respon pas pengembalian dana lambat tidak dibantu oleh pihak tokopedia chat malah ke ai customer service tidak ada responemng mantap ini mah,,negatif
terbaik,positif,positif
bagus,positif,positif
buruk sekali akun saya di non aktifkan tanpa penjelasan,,negatif
belanja susah sekali karna banyak yang tidak bisa cash on delivery tak seperti aplikasilainnyasemoga diperluas piturnya,,negatif
bagus banget,positif,positif
dulu terpercaya belanja disini sekarang smakin parah para penjualnya,,negatif
lambat banget abis updatemau kontak customer service loadingnya lama banget tidak kebuka bukaperbaiki servernya,,negatif
belanja online terbaik,positif,positif
sangat membantu untuk berbelanja,positif,positif
pelayanan tidak sesuai tidak bisa memecahkan permasalahan antara pembeli dan penjual,,negatif
sangat membantu tingkatkan kualitas dan pelayanan,positif,positif
mantap,positif,positif
bagus,positif,positif
pakai toko pedia banyak layanannya,positif,positif
baik,positif,positif
kartu tokopedia terbaik,positif,positif
cepat,positif,positif
prosesnya mudah dan cepat semoga pengirimannya juga cepat ya dan yang terpenting barangnya harus sesuai pesanan dan aman sampai di tangan saya selaku pembeli terima kasih toko pedia salam dari floresntt,positif,positif
saldo dana saya ilang kesedot aplikasi tokopedia apakah bisa kembali tolong bantuan nya untuk kembali,,negatif
seperti yang sudah² ecommerce yang sering nipu user dengan vocer belanja umurnya tidak bakal lama terutama developernya kalau tidak cepirit x sehari ya mati ketiban atap,,negatif
aplikasi lemot,,negatif
paket saya gatau di puter puter kemana saat pengiriman hadehh kecewa banget deh,,negatif
sangat puas belaja di sini sukses terus buat tim pengembang,positif,positif
semoga sukses selalu,positif,positif
program yang bagus,positif,positif
lambat saat di pencarian dan yang di cri tidak muncul atau beda dengan kata kunci,,negatif
sekarang fitur search dalam tokonya kenapa jadi bosok sekali jelas² barangnya ada dan tersedia tapi waktu dicari pakai kata kunci malah bilangnya produk tidak ditemukan,,negatif
mau milih metode pembayaran tidak bisa hanya layar putih,,negatif
kebanyakan ngelag mending di shopee,,negatif
komplain yang tanpa dijawab ai sebelah manapaham tidak jawbn ai malah membuat ribet,,negatif
ribet,,negatif
lambat,,negatif
saya sebagai seller merasa kecewa dan sangat dirugikan atas adanya vocher yang kalian buat dan keputusan yang tidak masuk akal yang tim customer service kalian lakukan tanpa ada unboxing dan minimnya bukti bisanya sengketa dimenangkan oleh si penipu pembeli tanpa barang saya dikirim balik uang hilang barang juga ilang saya pastikan saya akan off jualan di tokopedia,,negatif
pembelian produk menggunakan pembayaran gopay later yang sudah di lunasi hari setelah pembayaran produk ketika pembelian di batalkan saldo gopay saya yang di gunakan untuk melunasi gopay later tidak di kembalikan,,negatif
makasih tokopedia,positif,positif
oke dapat promo,positif,positif
kamu aplikasi udah kalah sama shopee cok mending di akusisi sama shopee dah dari pada bangkrut ongkir kamu kemahalan opsi layanan kurir aja susah amat diskon berasa bayar bea cukai dari harga barang kocak,,negatif
sudah tidak aman akun saya tiba statusnya nonaktif dengan keterangan dinonaktifkan secara mandiri padahal saya tidak pernah menonaktifkan akun orderan saya total sekitar rb belum ada yang saya terima pas mau ngecek riwayat transaksi akun sudah tidak bisa dibuka mengajukan komplain melalui tokopedia care tidak ada notifikasi atau tanggapan yang masuk melalui email atau wa,,negatif
semakin banyak yang baru pop up rekomendasi prodak setelah memasukan prodak yang ingin di beli muncul berkali kali akhirnya tidak jadi beli teks putih di atas background putis saat membuka home toko yang dituju konten review prodak yang nge loop tanpa loading konten baru prodak yang di jual di tiap berubah jadi prodak yang direkomendasikan tokopedia dan irelevant dengan toko yang sedang di check masa buka toko politron munculnya lemari dan samsung jual gerinda ryu update teros,,negatif
aplikasi bagus transaksi pakai dana cepat,positif,positif
tolong fitur tidak ingin melihat barang yang serupa nya betulbetul di koreksi berapa kali saya pencet barang yang sama sebagai iklan muncul terus ganggu banget,,negatif
tokopedia melindungi kepentingan konsumen dan penjual,positif,positif
menyulitkan seller malah ada app pihak ketiga tiktok senter buat apa tambah ribet hey developer mikir,,negatif
tidak bisa mengirim gambar ulasan penilaian barang dari galeri harus foto langsung tolong dikembalikan lagi seperti sebelum update bisa kirim foto dari pilihan galeri,,negatif
tokopedia jing gaada respon tokopedia care gaguna prcuma,,positif
pesanan saya barang tidak ada seller minta pembatalan karena barang kosong tetapi sampai saat ini pembatalan belum dikonfirmasi dan dana belum dikembalikan tokopedia sekarang sangat buruk ulasan mengenai pembatalan dan pengembalian dipersulit,,negatif
proses pengembalian dana nya hari kerja parah banget mending sebelah,,negatif
mantap,positif,positif
pelayanan customer servicenya buruk,,negatif
hati kena penipuan kemaren beli di salah satu official store brand ternama admin toko tidak memberikan informasi yang lengkap ketika barang sudah sampai ternyata tidak kompatible tidak sesuai dengan deskripsi yang di berikan oleh admin dan ketika pengajuan komplain admin tokopedia lebih memihak ke penjual tanpa memikirkan kerugian dari pembeli sedikitpun kecewa berat sih kok bisa member diamond dapat perlakuan seperti ini haha,,negatif
tiap checkout di suruh di batal sama toko nyaalesan stok habis padahal sbelum di co masih tersedia produk nya,,negatif
cepat mudah dan amanah,positif,positif
saya beli pompa air pakai gopaylater angsuran bulan sedangkan pompa yang saya beli baru minggu udah rusak tidak bisa di komplain dan pihak tokopedia tidak ada solusi buat bantu masalah saya tidak lagi belanja di tokopedia,,negatif
